"question","answer","template"
"Cancel my first meeting on December 23","calendar.delete_event.func(event_id='00000320')","{'question': 'Cancel my first meeting on {natural_language_date}', 'answer': ""calendar.delete_event.func(event_id='{first_event_id}')""}"
"Change the name of the last event on November 2 to Executive Leadership Offsite","calendar.update_event.func(event_id='00000293', field='event_name', new_value='Executive Leadership Offsite')","{'question': 'Change the name of the last event on {natural_language_date} to {event_name}', 'answer': ""calendar.update_event.func(event_id='{last_event_id}', field='event_name', new_value='{event_name}')""}"
"Push back my first meeting with Leila on December 28 by 1.5 hours","calendar.update_event.func(event_id='00000407', field='event_start', new_value='2023-12-28 10:30:00')","{'question': 'Push back my first meeting with {name} on {natural_language_date} by {duration}s', 'answer': ""calendar.update_event.func(event_id='{first_event_with_name_id}', field='event_start', new_value='{new_start}')""}"
"Delete the Technology Implementation Workshop event","calendar.delete_event.func(event_id='00000498')","{'question': 'Delete the {event_name} event', 'answer': ""calendar.delete_event.func(event_id='{event_id}')""}"
"Change the name of the Digital Marketing Trends Seminar event to Corporate Social Responsibility Day","calendar.update_event.func(event_id='00000350', field='event_name', new_value='Corporate Social Responsibility Day')","{'question': 'Change the name of the {event_name} event to {new_event_name}', 'answer': ""calendar.update_event.func(event_id='{event_id}', field='event_name', new_value='{new_event_name}')""}"
