email_id,inbox/outbox,sender/recipient,subject,sent_datetime,body
00000153,inbox,chenwei.zhang@atlas.com,Task Update on Design logo for e-commerce platform,2023-10-20 11:07:50,"Dear Sam,\n\nCompleted task 'Design logo for e-commerce platform' ahed of schedule. Please review and let me know if any tweaks are needed.\n\nI've been meaning to discuss the recent changes in our project timelines. We've had to make some adjustments to accommodate new client requirements and to ensure that we're delivering the best possible results. I'll be reaching out to you soon to discuss this in more detail, so please keep an eye out for my next email.\n\nCheers,\nChenwei"
00000389,inbox,santiago.martinez@atlas.com,Update on Digital Transformation Conference,2023-10-20 13:35:50,"Hey Sam,\n\nReminder about the Digital Transformation Conference next week. Let's make sure we're all prepared.\n\nRegards,\nSantiago"
00000115,inbox,aisha.chen@atlas.com,Task Update on Design UI for landing page,2023-10-20 15:31:23,"Hey Sam,\n\nRegarding task 'Design UI for landing page', I've made significant progress but have hit a snag with database integration. Could use a brainstorm session.\n\nBest,\nAisha"
00000374,inbox,nadia.moreau@atlas.com,Update on project progress update,2023-10-21 09:01:59,"Sam,\n\nReminder about the project progress update next week. lets make sure we're all prepared.\n\nI also wanted to share some exciting news about our upcoming team-building event. We've been planning a fun and engaging day for everyone, and I'm confident it will be a great opportunity for everyone to unwind and bond with their colleagues. I'll be sending out more details soon, so keep an eye out for that!\n\nThanks,\nNadia"
00000073,inbox,yuki.tanaka@atlas.com,Update on quarterly tech roundup,2023-10-21 09:29:29,"Hey Sam,\n\nI have some ideas for the quarterly tech roundup that I'd like to run by you. When are you free?\n\nThanks,\nYuki"
00000205,inbox,olga.petrova@atlas.com,Task Update on Implement payment gateway API,2023-10-21 11:26:31,"Sam,\n\nRegarding task 'Implement payment gateway API', I've made significant progress but have hit a snag with database integration. Could use a brainstorm session.\n\nThanks,\nOlga"
00000238,inbox,lena.schmidt@atlas.com,Task Update on Update brand colors in e-commerce platform,2023-10-21 11:31:44,"Sam,\n\nRegarding task 'Update brand colors in e-commerce platform', I've made significant progress but have hit a snag with UI responsiveness. Could use a brainstorm session.\n\nThanks,\nLena"
00000437,inbox,dmitri.ivanov@atlas.com,Task Update on Develop prototype for payment gateway,2023-10-21 12:47:08,"Hey Sam,\n\nCompleted task 'Develop prototype for payment gateway' ahead of schedule. Please review and let me know if any tweaks are needed.\n\nI also wanted to share some exciting news about our upcoming team-building event. We've been planning a fun and engaging day for everyone, and I'm confident it will be a great opportunity for everyone to unwindd and bond with their colleagues. I'll be sending out more details soon, so keep an eye out for that!\n\nBest,\nDmitri"
00000154,inbox,chenwei.zhang@atlas.com,Task Update on Fix alignment issue in homepage,2023-10-21 13:06:57,"Hi Sam,\n\nCompleted task 'Fix alignment issue in homepage' ahead of schedule. Please review and let me know if any tweaks are needed.\n\nThanks,\nChenwei"
00000054,inbox,nia.johnson@atlas.com,Update on status briefing,2023-10-21 14:36:21,"Sam,\n\nI wanted to let you know that I've completed the tasks for the status briefing. Looking forward to your feedback.\n\nThanks,\nNia"
00000350,inbox,anaya.patel@atlas.com,Update on New Employee Onboarding,2023-10-21 15:26:29,"Hi Sam,\n\nI wanted to let you know that I've completed the tasks for the New Employee Onboarding. Looking forward to your feedback.\n\nBest,\nAnaya"
00000069,inbox,nadia.moreau@atlas.com,Task Update on Create wireframe for homepage,2023-10-21 15:29:22,"Hi Sam,\n\nStarting on 'Create wireframe for homepage' today. Any preliminary thoughts or resources you recommend before I dive in?\n\nBest,\nNadia"
00000039,inbox,kofi.mensah@atlas.com,Task Update on Optimize database query for report generation,2023-10-22 10:27:03,"Dear Sam,\n\nCompleted task 'Optimize database query for report generation' ahead of schedule. Please review and let me know if any tweaks are needed.\n\nCheers,\nKofi"
00000191,inbox,kofi.mensah@atlas.com,Update on team coordination meeting,2023-10-22 12:47:47,"Hey Sam,\n\nCould you provide your input on the team coordination meeting planning? Your insights would be really valuable.\n\nI've been meaning to discuss the recent changes in our project timelines. We've had to make some adjustments to accommodate new client requirements and to ensure that Were delivering the best possible results. I'll be reaching out to you soon to discuss this in more detail, so please keep an eye out for my next email.\n\nRegards,\nKofi"
00000221,inbox,carlos.rodriguez@atlas.com,Task Update on Update brand colors in website,2023-10-22 12:56:11,"Hey Sam,\n\nCompleted task 'Update brand colors in website' ahead of schedule. Please review and let me know if any tweaks are needed.\n\nCheers,\nCarlos"
00000450,inbox,carlos.rodriguez@atlas.com,Update on Corporate Governance Workshop,2023-10-22 12:57:02,"Dear Sam,\n\nI have some ideas for the Corporate Governance Workshop that I'd like to run by you. When are you free?\n\nRegards,\nCarlos"
00000203,inbox,raj.patel@atlas.com,Update on Year-End Performance Assessment,2023-10-22 15:15:39,"Hey Sam,\n\nI have some ideas for the Year-End Performance Assessment that I'd like to run by you. When are you free?\n\nI also wanted to share some exciting news about our upcoming team-building event. We've been planning a fun and engaging day for everyone, and I'm confident it will be a great opportunity for everyone to unwindd and bond with their colleagues. I'll be sending out more details soon, so keep an eye out for that!\n\nCheers,\nRaj"
00000381,inbox,lena.schmidt@atlas.com,Task Update on Implement user profile management API,2023-10-23 10:35:37,"Hey Sam,\n\nCompleted task 'Implement user profile management API' ahead of schedule. Please review and let me know if any tweaks are needed.\n\nThanks,\nLena"
00000224,inbox,anaya.patel@atlas.com,Update on weekly summary,2023-10-23 11:39:42,"Hi Sam,\n\nI wanted to let you know that I've completed the tasks for the weekly summary. Looking forward to your feedback.\n\nBest,\nAnaya"
00000009,inbox,anaya.patel@atlas.com,Task Update on Fix alignment issue in profile page,2023-10-23 11:42:14,"Hey Sam,\n\nStarting on 'Fix alignment issue in profile page' today. Any preliminary thoughts or resources you recommend before I dive in?\n\nAdditionnally, I wanted to touch base on some other areas we've been focusing on lately. Our team has been working tirelessly on improving our project management workflows and enhancing collaboration across departments. This effort includes adopting new tools, refining our communication strategies, and ensuring that all team members are fully aligned with our objectives.\n\nBest,\nAnaya"
00000077,inbox,fatima.khan@atlas.com,Update on retrospective meeting,2023-10-23 12:04:21,"Hey Sam,\n\nI have some ideas for the retrospective meeting that I'd like to run by you. When are you free?\n\nAdditionally, I wanted to touch base on some other areas we've been focusing on lately. Our team has been working tirelessly on improving our project management workflows and enhancing collabaration across departments. This effort includes adopting new tools, refining our communication strategies, and ensuring that all team members are fully aligned with our objectives.\n\nCheers,\nFatima"
00000392,inbox,raj.patel@atlas.com,Update on team evaluation,2023-10-23 13:31:42,"Hey Sam,\n\nThanks for the invite. Looking forward to it!\n\nThanks,\nRaj"
00000250,inbox,aisha.chen@atlas.com,Task Update on Optimize database query for user management,2023-10-23 14:52:48,"Hey Sam,\n\nRegarding task 'Optimize database query for user management', I've made significant progress but have hit a snag with database integration. Could use a brainstorm session.\n\nCheers,\nAisha"
00000298,inbox,aisha.chen@atlas.com,Update on brainstorming session,2023-10-23 15:19:20,"Sam,\n\nI wanted to let you know that I've completed the tasks for the brainstorming session. Looking forward to your feedback.\n\nI've been meaning to discuss the recennt changes in our project timelines. We've had to make some adjustments to accommodate new client requirements and to ensure that we're delivering the best possible results. I'll be reaching out to you soon to discuss this in more detail, so please keep an eye out for my next email.\n\nCheers,\nAisha"
00000216,inbox,raj.patel@atlas.com,Task Update on Design logo for website,2023-10-23 15:20:35,"Hi Sam,\n\nStarting on 'Design logo for website' today. Any preliminary thoughts or resources you recommend before I dive in?\n\nBest,\nRaj"
00000283,inbox,anaya.patel@atlas.com,Task Update on Develop prototype for login system,2023-10-24 10:22:43,"Hey Sam,\n\nCompleted task 'Develop prototype for login system' ahead of schedule. Please review and let me know if any tweaks are needed.\n\nThanks,\nAnaya"
00000209,inbox,nadia.moreau@atlas.com,Update on Employee Recognition Event,2023-10-24 11:25:06,"Hi Sam,\n\nI'm reaching out to discuss our upcoming Employee Recognition Event. Can we schedule a meeting to go over the details?\n\nRegards,\nNadia"
00000179,inbox,jinsoo.kim@atlas.com,Update on project debrief,2023-10-24 11:49:00,"Hi Sam,\n\nThanks for the invite. Looking forward to it!\n\nAdditionally, I wanted to touch base on some other areas we've been focusing on lately. Our team has been working tirelessly on improving our project management workflows and enhancing collaboration across departments. This effort includes adopting new tools, refining our comunication strategies, and ensuring that all team members are fully aligned with our objectives.\n\nRegards,\nJinsoo"
00000152,inbox,yuki.tanaka@atlas.com,Update on weekly summary,2023-10-24 12:07:12,"Sam,\n\nThanks for the invite. Looking forward to it!\n\nRegards,\nYuki"
00000257,inbox,fatima.khan@atlas.com,Task Update on Add animation to carousel,2023-10-24 14:03:17,"Hi Sam,\n\nRegarding task 'Add animation to carousel', I've made significant progress but have hit a snag with UI responsiveness. Could use a brainstorm session.\n\nCheers,\nFatima"
00000386,inbox,fatima.khan@atlas.com,Task Update on Design logo for website,2023-10-24 14:13:09,"Dear Sam,\n\nRegarding task 'Design logo for website', I've made significant progress but have hit a snag with database integration. Could use a brainstorm session.\n\nCheers,\nFatima"
00000323,inbox,leila.azizi@atlas.com,Task Update on Add animation to form submission button,2023-10-24 15:18:39,"Sam,\n\nCompleted task 'Add animation to form submission button' ahead of schedule. Please review and let me know if any tweaks are needed.\n\nRegards,\nLeila"
00000273,inbox,dmitri.ivanov@atlas.com,Update on team coordination meeting,2023-10-24 15:45:13,"Hi Sam,\n\nI wanted to let you know that Iv completed the tasks for the team coordination meeting. Looking forward to your feedback.\n\nIv been meaning to discuss the recent changes in our project timelines. We've had to make some adjustments to accommodate new client requirements and to ensure that we're delivering the best possible results. I'll be reaching out to you soon to discuss this in more detail, so please keep an eye out for my next email.\n\nThanks,\nDmitri"
00000010,inbox,luis.ortiz@atlas.com,Update on Client Appreciation Gala,2023-10-25 10:25:46,"Hi Sam,\n\nI have some ideas for the Client Appreciation Gala that I'd like to run by you. When are you free?\n\nRegards,\nLuis"
00000078,inbox,jinsoo.kim@atlas.com,Update on Project Initiation Meeting,2023-10-25 10:40:15,"Hi Sam,\n\nThanks for the invite. Looking forward to it!\n\nCheers,\nJinsoo"
00000265,inbox,kofi.mensah@atlas.com,Task Update on Develop prototype for report generation,2023-10-25 11:05:50,"Hey Sam,\n\nCompleted task 'Develop prototype for report generation' ahead of schedule. Please review and let me know if any tweaks are needed.\n\nCheers,\nKofi"
00000043,inbox,santiago.martinez@atlas.com,Task Update on Fix bug in content delivery module,2023-10-25 11:29:23,"Dear Sam,\n\nRegarding task 'Fix bug in content delivery module', I've made significant progress but have hit a snag with database integration. Could use a brainstorm session.\n\nThanks,\nSantiago"
00000290,inbox,fatima.khan@atlas.com,Task Update on Optimize database query for user management,2023-10-25 11:53:14,"Hey Sam,\n\nRegarding task 'Optimize database query for user management', I've made significant progress but have hit a snag with UI responsiveness. Could use a brainstorm session.\n\nCheers,\nFatima"
00000127,inbox,akira.sato@atlas.com,Update on Team Building Retreat,2023-10-25 12:37:10,"Hey Sam,\n\nThanks for the invite. Looking forward to it!\n\nBest,\nAkira"
00000395,inbox,aisha.chen@atlas.com,Task Update on Update react to latest version,2023-10-25 13:20:38,"Hey Sam,\n\nI've been assigned 'Update react to latest version'. Excited to work on this and confident it will greatly improve our security protocols.\n\nBest,\nAisha"
00000114,inbox,kofi.mensah@atlas.com,Task Update on Implement payment gateway API,2023-10-25 13:50:06,"Sam,\n\nStarting on 'Implement payment gateway API' today. Any preliminary thoughts or resources you recommend before I dive in?\n\nI've been meaning to discuss the recent changes in our project timelines. We've had to make some adjustments to accommodate new client requirements and to ensure that Were delivering the best possible results. I'll be reaching out to you soon to discuss this in more detail, so please keep an eye out for my next email.\n\nRegards,\nKofi"
00000416,inbox,carlos.rodriguez@atlas.com,Task Update on Update brand colors in website,2023-10-25 13:53:46,"Hey Sam,\n\nCompleted task 'Update brand colors in website' ahead of schedule. Please review and let me know if any tweaks are needed.\n\nCheers,\nCarlos"
00000302,inbox,leila.azizi@atlas.com,Task Update on Integrate Google Maps API with frontend,2023-10-25 15:56:49,"Sam,\n\nCompleted task 'Integrate Google Maps API with frontend' ahead of schedule. Please review and let me know if any tweaks are needed.\n\nCheers,\nLeila"
00000131,inbox,luis.ortiz@atlas.com,Task Update on Add animation to form submission button,2023-10-26 09:02:38,"Sam,\n\nRegarding task 'Add animation to form submission button', I've made significant progress but have hit a snag with third-party API compatibility. Could use a brainstorm session.\n\nCheers,\nLuis"
00000387,inbox,luis.ortiz@atlas.com,Task Update on Implement user profile management API,2023-10-26 09:08:04,"Hey Sam,\n\nRegarding task 'Implement user profile management API', I've made significant progress but have hit a snag with UI responsiveness. Could use a brainstorm session.\n\nI've been meaning to discuss the recent changes in our project timelines. We've had to make some adjusments to accommodate new client requirements and to ensure that we're delivering the best possible results. I'll be reaching out to you soon to discuss this in more detail, so please keep an eye out for my next email.\n\nRegards,\nLuis"
00000462,inbox,aisha.chen@atlas.com,Update on IT Systems Update Briefing,2023-10-26 09:19:41,"Dear Sam,\n\nThanks for the invite. Looking forward to it!\n\nBest,\nAisha"
00000000,inbox,yuki.tanaka@atlas.com,Task Update on Fix alignment issue in profile page,2023-10-26 09:55:04,"Hey Sam,\n\nCompleted task 'Fix alignment issue in profile page' ahead of schedule. Please review and let me know if any tweaks are needed.\n\nRegards,\nYuki"
00000232,inbox,anaya.patel@atlas.com,Update on Board of Directors Conclave,2023-10-26 11:00:12,"Hey Sam,\n\nEncountered a few challenges while working on the Board of Directors Conclave. Could use your advice.\n\nThanks,\nAnaya"
00000023,inbox,anaya.patel@atlas.com,Update on process review,2023-10-26 11:47:43,"Hey Sam,\n\nReminder about the process review next week. Let's make sure we're all prepared.\n\nCheers,\nAnaya"
00000357,inbox,anaya.patel@atlas.com,Update on Diversity & Inclusion Workshop,2023-10-26 12:22:13,"Hey Sam,\n\nThanks for the invite. Looking forward to it!\n\nAdditionally, I wanted to touch base on some other areas we've been focusing on lately. Our team has been working tirelessly on improving our project management workflows and enhancing collaboration across departments. This effort includes adopting new tools, refining our comunication strategies, and ensuring that all team members are fully aligned with our objectives.\n\nRegards,\nAnaya"
00000324,inbox,fatima.khan@atlas.com,Update on introductory call,2023-10-26 13:07:00,"Hey Sam,\n\nCould you provide your input on the introductory call planning? Your insights would be really valuable.\n\nBest,\nFatima"
00000222,inbox,olga.petrova@atlas.com,Update on Client Appreciation Gala,2023-10-26 13:42:37,"Hey Sam,\n\nI wanted to let you know that I've completed the tasks for the Client Appreciation Gala. Looking forward to your feedback.\n\nI've been meaning to discuss the recent changes in our project timelines. We've had to make some adjusments to accommodate new client requirements and to ensure that we're delivering the best possible results. I'll be reaching out to you soon to discuss this in more detail, so please keep an eye out for my next email.\n\nBest,\nOlga"
00000314,inbox,leila.azizi@atlas.com,Task Update on Integrate Google Maps API with frontend,2023-10-26 14:24:59,"Sam,\n\nCompleted task 'Integrate Google Maps API with frontend' ahead of schedule. Please review and let me know if any tweaks are needed.\n\nCheers,\nLeila"
00000473,inbox,jinsoo.kim@atlas.com,Task Update on Update react to latest version,2023-10-26 14:37:57,"Hi Sam,\n\nStarting on 'Update react to latest version' today. Any preliminary thoughts or resources you recommend before I dive in?\n\nI've been meaning to discuss the recennt changes in our project timelines. We've had to make some adjustments to accommodate new client requirements and to ensure that we're delivering the best possible results. I'll be reaching out to you soon to discuss this in more detail, so please keep an eye out for my next email.\n\nCheers,\nJinsoo"
00000160,inbox,kofi.mensah@atlas.com,Task Update on Fix bug in user management module,2023-10-26 15:14:01,"Hi Sam,\n\nI've been assigned 'Fix bug in user management module'. Excited to work on this and confident it will greatly improve our security protocols.\n\nRegards,\nKofi"
00000489,inbox,raj.patel@atlas.com,Update on Year-End Performance Assessment,2023-10-27 09:58:39,"Sam,\n\nReminder about the Year-End Performance Assessment next week. Let's make sure we're all prepared.\n\nThanks,\nRaj"
00000319,inbox,dmitri.ivanov@atlas.com,Task Update on Develop prototype for payment gateway,2023-10-27 09:59:29,"Hey Sam,\n\nCompleted task 'Develop prototype for payment gateway' ahead of schedule. Please review and let me know if any tweaks are needed.\n\nI also wanted to share some exciting news about our upcoming team-building event. We've been planning a fun and engaging day for everyone, and I'm confident it will be a great opportunity for everyone to unwindd and bond with their colleagues. I'll be sending out more details soon, so keep an eye out for that!\n\nBest,\nDmitri"
00000048,inbox,lena.schmidt@atlas.com,Update on Leadership Training Workshop,2023-10-27 12:23:02,"Sam,\n\nReminder about the Leadership Training Workshop next week. Let's make sure we're all prepared.\n\nThanks,\nLena"
00000084,inbox,amir.ali@atlas.com,Update on team coordination meeting,2023-10-27 12:35:45,"Hi Sam,\n\nI wanted to let you know that I've completed the tasks for the team coordination meeting. Looking forward to your feedback.\n\nCheers,\nAmir"
00000296,inbox,luis.ortiz@atlas.com,Task Update on Optimize database query for report generation,2023-10-27 12:36:23,"Hey Sam,\n\nI've been assigned 'Optimize database query for report generation'. Excited to work on this and confident it will greatly improve our user experience.\n\nCheers,\nLuis"
00000407,inbox,fatima.khan@atlas.com,Task Update on Update Django to latest version,2023-10-27 13:21:16,"Hey Sam,\n\nCompleted task 'Update Django to latest version' ahead of schedule. Please review and let me know if any tweaks are needed.\n\nCheers,\nFatima"
00000121,inbox,amir.ali@atlas.com,Task Update on Fix alignment issue in profile page,2023-10-27 13:25:29,"Hi Sam,\n\nCompleted task 'Fix alignment issue in profile page' ahead of schedule. Please review and let me know if any tweaks are needed.\n\nThanks,\nAmir"
00000260,inbox,lena.schmidt@atlas.com,Task Update on Update brand colors in e-commerce platform,2023-10-27 13:36:36,"Sam,\n\nRegarding task 'Update brand colors in e-commerce platform', I've made significant progress but have hit a snag with UI responsiveness. Could use a brainstorm session.\n\nThanks,\nLena"
00000355,inbox,luis.ortiz@atlas.com,Update on annual summary,2023-10-27 13:40:19,"Hi Sam,\n\nReminder about the annual summary next week. Let's make sure we're all prepared.\n\nCheers,\nLuis"
00000042,inbox,anaya.patel@atlas.com,Update on weekly summary,2023-10-27 15:47:42,"Hey Sam,\n\nCould you provide your input on the weekly summary planning? Your insights would be really valuable.\n\nBest,\nAnaya"
00000006,inbox,nia.johnson@atlas.com,Update on Diversity & Inclusion Workshop,2023-10-27 15:51:16,"Hi Sam,\n\nI have some ideas for the Diversity & Inclusion Workshop that I'd like to run by you. When are you free?\n\nBest,\nNia"
00000341,inbox,nadia.moreau@atlas.com,Task Update on Add authentication for cloud storage,2023-10-28 12:01:52,"Sam,\n\nStarting on 'Add authentication for cloud storage' today. Any preliminary thoughts or resources you reccomend before I dive in?\n\nAdditionally, I wanted to touch base on some other areas we've been focusing on lately. Our team has been working tirelessly on improving our project management workflows and enhancing collaboration across departments. This effort includes adopting new tools, refining our communication strategies, and ensuring that all team members are fully aligned with our objectives.\n\nRegards,\nNadia"
00000236,inbox,raj.patel@atlas.com,Update on Year-End Performance Assessment,2023-10-28 12:15:39,"Hey Sam,\n\nI have some ideas for the Year-End Performance Assessment that I'd like to run by you. When are you free?\n\nI also wanted to share some exciting news about our upcoming team-building event. We've been planning a fun and engaging day for everyone, and I'm confident it will be a great opportunity for everyone to unwindd and bond with their colleagues. I'll be sending out more details soon, so keep an eye out for that!\n\nCheers,\nRaj"
00000104,inbox,fatima.khan@atlas.com,Task Update on Fix alignment issue in profile page,2023-10-28 12:18:51,"Hey Sam,\n\nI've been assigned 'Fix alignment issue in profile page'. Excited to work on this and confident it will greatly improve our security protocols.\n\nRegards,\nFatima"
00000083,inbox,nadia.moreau@atlas.com,Task Update on Implement responsive layout for profile page,2023-10-28 12:26:42,"Dear Sam,\n\nI've been assigned 'Implement responsive layout for profile page'. Excited to work on this and confident it will greatly improve our security protocols.\n\nRegards,\nNadia"
00000394,inbox,aisha.chen@atlas.com,Task Update on Implement payment gateway API,2023-10-28 12:52:52,"Sam,\n\nCompleted task 'Implement payment gateway API' ahead of schedule. Please review and let me know if any tweaks are needed.\n\nBest,\nAisha"
00000358,inbox,akira.sato@atlas.com,Task Update on Optimize database query for user management,2023-10-28 13:44:15,"Sam,\n\nCompleted task 'Optimize database query for user management' ahead of schedule. Please review and let me know if any tweaks are needed.\n\nCheers,\nAkira"
00000156,inbox,lena.schmidt@atlas.com,Update on project debrief,2023-10-28 15:17:22,"Sam,\n\nCould you provide your input on the project debrief planning? Your insights would be really valuable.\n\nThanks,\nLena"
00000046,inbox,aisha.chen@atlas.com,Task Update on Design logo for website,2023-10-29 09:04:36,"Hi Sam,\n\nI've been assigned 'Design logo for website'. Excited to work on this and confident it will greatly improve our user experience.\n\nRegards,\nAisha"
00000044,inbox,aisha.chen@atlas.com,Task Update on Design logo for e-commerce platform,2023-10-29 09:08:21,"Hey Sam,\n\nRegarding task 'Design logo for e-commerce platform', I've made signficant progress but have hit a snag with database integration. Could use a brainstorm session.\n\nAdditionally, I wanted to touch base on some other areas we've been focusing on lately. Our team has been working tirelessly on improving our project management workflows and enhancing collaboration across departments. This effort includes adopting new tools, refining our communication strategies, and ensuring that all team members are fully aligned with our objectives.\n\nBest,\nAisha"
00000107,inbox,aisha.chen@atlas.com,Task Update on Implement payment gateway API,2023-10-29 10:36:00,"Sam,\n\nCompleted task 'Implement payment gateway API' ahead of schedule. Please review and let me know if any tweaks are needed.\n\nBest,\nAisha"
00000079,inbox,aisha.chen@atlas.com,Update on Machine Learning Chat,2023-10-29 11:28:17,"Sam,\n\nCould you provide your input on the Machine Learning Chat planning? Your insights would be really valuable.\n\nThanks,\nAisha"
00000330,inbox,akira.sato@atlas.com,Update on performance evaluation,2023-10-29 12:09:02,"Hi Sam,\n\nCould you provide your input on the performance evaluation planning? Your insights would be really valuable.\n\nBest,\nAkira"
