email_id,inbox/outbox,sender/recipient,subject,sent_datetime,body
00000225,inbox,nadia.moreau@atlas.com,Update on daily stand-up,2023-11-08 13:02:35,"Hey Sam,\n\nI'm reaching out to discuss our upcoming daily stand-up. Can we schedule a meeting to go over the details?\n\nBest,\nNadia"
00000307,inbox,leila.azizi@atlas.com,Task Update on Update brand colors in e-commerce platform,2023-11-08 14:04:59,"Hi Sam,\n\nStarting on 'Update brand colors in e-commerce platform' today. Any preliminary thoughts or resources you recommend before I dive in?\n\nAdditionally, I wanted to touch base on some other areas we've been focusing on lately. Our team has been working tirelessly on improving our project management workflows and enhancing collaboration across departments. This effort includes adopting new tools, refining our communication strategies, and ensuring that all team members are fully aligned with our objectifs.\n\nThanks,\nLeila"
00000049,inbox,akira.sato@atlas.com,Task Update on Implement responsive layout for profile page,2023-11-08 14:07:01,"Hey Sam,\n\nRegarding task 'Implement responsive layout for profile page', I've made significant progress but have hit a snag with third-party API compatibility. Could use a brainstorm session.\n\nBest,\nAkira"
00000207,inbox,leila.azizi@atlas.com,Task Update on Fix bug in content delivery module,2023-11-08 14:13:22,"Sam,\n\nCompleted task 'Fix bug in content delivery module' ahead of schedule. Please review and let me know if any tweaks are needed.\n\nBest,\nLeila"
00000193,inbox,fatima.khan@atlas.com,Task Update on Fix alignment issue in profile page,2023-11-08 14:37:11,"Hey Sam,\n\nI've been assigned 'Fix alignment issue in profile page'. Excited to work on this and confident it will greatly improve our security protocols.\n\nRegards,\nFatima"
00000453,inbox,dmitri.ivanov@atlas.com,Update on team orientation,2023-11-08 15:13:01,"Hey Sam,\n\nEncountered a few challenges while working on the team orientation. Could use your advice.\n\nRegards,\nDmitri"
00000487,inbox,fatima.khan@atlas.com,Task Update on Develop prototype for login system,2023-11-08 15:41:57,"Sam,\n\nI've been assigned 'Develop prototype for login system'. Excited to work on this and confident it will greatly improve our backend efficiency.\n\nI also wanted to share some exciting news about our upcomming team-building event. We've been planning a fun and engaging day for everyone, and I'm confident it will be a great opportunity for everyone to unwind and bond with their colleagues. I'll be sending out more details soon, so keep an eye out for that!\n\nRegards,\nFatima"
00000343,inbox,kofi.mensah@atlas.com,Task Update on Develop prototype for report generation,2023-11-09 09:22:41,"Hey Sam,\n\nCompleted task 'Develop prototype for report generation' ahead of schedule. Please review and let me know if any tweaks are needed.\n\nCheers,\nKofi"
00000125,inbox,nia.johnson@atlas.com,Update on Machine Learning Chat,2023-11-09 10:07:35,"Hi Sam,\n\nI have some ideas for the Machine Learning Chat that I'd like to run by you. When are you free?\n\nBest,\nNia"
00000217,inbox,lena.schmidt@atlas.com,Task Update on Optimize database query for search functionality,2023-11-09 10:36:49,"Hey Sam,\n\nStarting on 'Optimize database query for search functionality' today. Any preliminary thoughts or resources you recommend before I dive in?\n\nBest,\nLena"
00000282,inbox,fatima.khan@atlas.com,Update on Employee Recognition Event,2023-11-09 12:45:31,"Hey Sam,\n\nI have some ideas for the Employee Recognition Event that I'd like to run by you. When are you free?\n\nBest,\nFatima"
00000255,inbox,dmitri.ivanov@atlas.com,Update on IT Systems Update Briefing,2023-11-09 13:14:07,"Dear Sam,\n\nI have some ideas for the IT Systems Update Briefing that I'd like to run by you. When are you free?\n\nCheers,\nDmitri"
00000019,inbox,akira.sato@atlas.com,Update on feedback discussion,2023-11-09 13:47:25,"Hi Sam,\n\nReminder about the feedback discussion next week. Let's make sure we're all prepared.\n\nCheers,\nAkira"
00000248,inbox,luis.ortiz@atlas.com,Update on Team Building Retreat,2023-11-09 13:57:13,"Hi Sam,\n\nI have some ideas for the Team Building Retreat that I'd like to run by you. When are you free?\n\nRegards,\nLuis"
00000270,inbox,kofi.mensah@atlas.com,Task Update on Fix alignment issue in homepage,2023-11-09 15:40:28,"Dear Sam,\n\nRegarding task 'Fix alignment issue in homepage', I've made significant progress but have hit a snag with third-party API compatibility. Could use a brainstorm session.\n\nRegards,\nKofi"
00000375,inbox,fatima.khan@atlas.com,Task Update on Add authentication for email notification,2023-11-10 10:24:04,"Dear Sam,\n\nCompleted task 'Add authentication for email notification' ahead of schedule. Please review and let me know if any tweaks are needed.\n\nCheers,\nFatima"
00000059,inbox,leila.azizi@atlas.com,Update on status briefing,2023-11-10 12:14:35,"Hey Sam,\n\nI wanted to let you know that I've completed the tasks for the status briefing. Looking forward to your feedback.\n\nCheers,\nLeila"
00000003,inbox,raj.patel@atlas.com,Update on team evaluation,2023-11-10 13:09:11,"Hey Sam,\n\nThanks for the invite. Looking forward to it!\n\nThanks,\nRaj"
00000228,inbox,akira.sato@atlas.com,Update on Team Building Retreat,2023-11-10 13:39:04,"Hey Sam,\n\nThanks for the invite. Looking forward to it!\n\nBest,\nAkira"
00000439,inbox,dmitri.ivanov@atlas.com,Update on weekly summary,2023-11-10 14:45:27,"Sam,\n\nCould you provide your input on the weekly summary planning? Your insights would be really valuable.\n\nThanks,\nDmitri"
00000322,inbox,raj.patel@atlas.com,Update on project debrief,2023-11-10 15:42:13,"Sam,\n\nEncountered a few challenges while working on the project debrief. Could use your advice.\n\nRegards,\nRaj"
00000135,inbox,nadia.moreau@atlas.com,Task Update on Update brand colors in website,2023-11-11 10:14:35,"Sam,\n\nI've been assigned 'Update brand colors in website'. Excited to work on this and confident it will greatly improve our user experience.\n\nRegards,\nNadia"
00000271,inbox,anaya.patel@atlas.com,Task Update on Design logo for blog,2023-11-11 11:28:15,"Hey Sam,\n\nRegarding task 'Design logo for blog', I've made significant progress but have hit a snag with database integration. Could use a brainstorm session.\n\nThanks,\nAnaya"
00000318,inbox,anaya.patel@atlas.com,Task Update on Design UI for settings page,2023-11-11 12:16:36,"Sam,\n\nStarting on 'Design UI for settings page' today. Any preliminary thoughts or resources you recommend before I dive in?\n\nBest,\nAnaya"
00000470,inbox,aisha.chen@atlas.com,Update on brainstorming session,2023-11-11 13:26:55,"Sam,\n\nI wanted to let you know that I've completed the tasks for the brainstorming session. Looking forward to your feedback.\n\nI've been meaning to discuss the recennt changes in our project timelines. We've had to make some adjustments to accommodate new client requirements and to ensure that we're delivering the best possible results. I'll be reaching out to you soon to discuss this in more detail, so please keep an eye out for my next email.\n\nCheers,\nAisha"
00000178,inbox,raj.patel@atlas.com,Update on project debrief,2023-11-11 14:16:40,"Hey Sam,\n\nCould you provide your input on the project debrief planning? Your insights would be really valuable.\n\nBest,\nRaj"
00000256,inbox,leila.azizi@atlas.com,Task Update on Implement user profile management API,2023-11-11 15:06:25,"Sam,\n\nRegarding task 'Implement user profile management API', I've made significant progress but have hit a snag with UI responsiveness. Could use a brainstorm session.\n\nI also wanted to share some exciting news about our upcoming team-building event. We've been planning a fun and engagging day for everyone, and I'm confident it will be a great opportunity for everyone to unwind and bond with their colleagues. I'll be sending out more details soon, so keep an eye out for that!\n\nCheers,\nLeila"
00000396,inbox,luis.ortiz@atlas.com,Task Update on Develop prototype for login system,2023-11-11 15:20:17,"Dear Sam,\n\nStarting on 'Develop prototype for login system' today. Any preliminary thoughts or resources you recommend before I dive in?\n\nCheers,\nLuis"
00000361,inbox,carlos.rodriguez@atlas.com,Update on project checkpoint,2023-11-12 10:18:22,"Hey Sam,\n\nEncountered a few challenges while working on the project checkpoint. Could use your advise.\n\nI also wanted to share some exciting news about our upcoming team-building event. We've been planning a fun and engaging day for everyone, and I'm confident it will be a great opportunity for everyone to unwind and bond with their colleagues. I'll be sending out more details soon, so keep an eye out for that!\n\nBest,\nCarlos"
00000122,inbox,luis.ortiz@atlas.com,Task Update on Add animation to form submission button,2023-11-12 10:28:20,"Hi Sam,\n\nStarting on 'Add animation to form submission button' today. Any preliminary thoughts or resources you recommend before I dive in?\n\nRegards,\nLuis"
00000321,inbox,akira.sato@atlas.com,Task Update on Add authentication for third-party login,2023-11-12 10:30:01,"Sam,\n\nI've been assigned 'Add authentication for third-party login'. Excited to work on this and confident it will greatly improve our backend efficiency.\n\nBest,\nAkira"
00000413,inbox,akira.sato@atlas.com,Update on Marketing Strategy Session,2023-11-12 11:20:32,"Hi Sam,\n\nReminder about the Marketing Strategy Session next week. Let's make sure we're all prepared.\n\nBest,\nAkira"
00000098,inbox,leila.azizi@atlas.com,Task Update on Optimize database query for report generation,2023-11-12 11:58:31,"Hi Sam,\n\nStarting on 'Optimize database query for report generation' today. Any preliminary thoughts or resources you recommend before I dive in?\n\nCheers,\nLeila"
00000194,inbox,nadia.moreau@atlas.com,Update on feedback discussion,2023-11-12 12:43:25,"Hey Sam,\n\nI'm reaching out to discuss our upcoming feedback discussion. Can we schedule a meeting to go over the details?\n\nBest,\nNadia"
00000223,inbox,fatima.khan@atlas.com,Task Update on Update brand colors in website,2023-11-12 13:50:22,"Dear Sam,\n\nCompleted task 'Update brand colors in website' ahead of schedule. Please review and let me know if any tweaks are needed.\n\nCheers,\nFatima"
00000499,inbox,santiago.martinez@atlas.com,Update on Project Initiation Meeting,2023-11-12 13:57:19,"Dear Sam,\n\nCould you provide your input on the Project Initiation Meeting planning? Your insights would be really valuable.\n\nBest,\nSantiago"
00000404,inbox,nadia.moreau@atlas.com,Task Update on Develop prototype for login system,2023-11-12 14:06:42,"Dear Sam,\n\nStarting on 'Develop prototype for login system' today. Any preliminary thoughts or resources you recommend before I dive in?\n\nI also wanted to share some exciting news about our upcomming team-building event. We've been planning a fun and engaging day for everyone, and I'm confident it will be a great opportunity for everyone to unwind and bond with their colleagues. I'll be sending out more details soon, so keep an eye out for that!\n\nBest,\nNadia"
00000050,inbox,anaya.patel@atlas.com,Task Update on Develop prototype for payment gateway,2023-11-12 14:17:18,"Hey Sam,\n\nStarting on 'Develop prototype for payment gateway' today. Any preliminary thoughts or resources you recommend before I dive in?\n\nBest,\nAnaya"
00000482,inbox,aisha.chen@atlas.com,Task Update on Design UI for landing page,2023-11-12 15:02:22,"Sam,\n\nI've been assigned 'Design UI for landing page'. Excited to work on this and confident it will greatly improve our backend efficiency.\n\nBest,\nAisha"
00000159,inbox,santiago.martinez@atlas.com,Update on Year-End Performance Assessment,2023-11-12 15:46:26,"Sam,\n\nI have some ideas for the Year-End Performance Assessment that I'd like to run by you. When are you free?\n\nBest,\nSantiago"
00000132,inbox,anaya.patel@atlas.com,Update on Leadership Training Workshop,2023-11-13 09:04:59,"Dear Sam,\n\nI wanted to let you know that I've completed the tasks for the Leadership Training Workshop. Looking forward to your feedback.\n\nI've been meaning to discuss the recent changes in our project timelines. We've had to make some adjustments to accommodate new client requirements and to ensure that Were delivering the best possible results. I'll be reaching out to you soon to discuss this in more detail, so please keep an eye out for my next email.\n\nThanks,\nAnaya"
00000062,inbox,anaya.patel@atlas.com,Update on Annual Budget Planning Session,2023-11-13 09:11:50,"Hi Sam,\n\nI'm reaching out to discuss our upcoming Annual Budget Planning Session. Can we schedule a meeting to go over the details?\n\nRegards,\nAnaya"
00000480,inbox,yuki.tanaka@atlas.com,Update on Quarterly Sales Review,2023-11-13 10:23:34,"Sam,\n\nI have some ideas for the Quarterly Sales Review that I'd like to run by you. When are you free?\n\nBest,\nYuki"
00000412,inbox,akira.sato@atlas.com,Update on IT Systems Update Briefing,2023-11-13 11:06:26,"Hey Sam,\n\nEncountered a few challenges while working on the IT Systems Update Briefing. Could use your advise.\n\nAdditionally, I wanted to touch base on some other areas we've been focusing on lately. Our team has been working tirelessly on improving our project management workflows and enhancing collaboration across departments. This effort includes adopting new tools, refining our communication strategies, and ensuring that all team members are fully aligned with our objectives.\n\nBest,\nAkira"
00000258,inbox,anaya.patel@atlas.com,Update on Innovation and Creativity Hackathon,2023-11-13 11:56:17,"Hey Sam,\n\nEncountered a few challenges while working on the Innovation and Creativity Hackathon. Could use your advice.\n\nThanks,\nAnaya"
00000093,inbox,anaya.patel@atlas.com,Update on Diversity & Inclusion Workshop,2023-11-13 12:01:52,"Hey Sam,\n\nThanks for the invite. Looking forward to it!\n\nAdditionally, I wanted to touch base on some other areas we've been focusing on lately. Our team has been working tirelessly on improving our project management workflows and enhancing collaboration across departments. This effort includes adopting new tools, refining our comunication strategies, and ensuring that all team members are fully aligned with our objectives.\n\nRegards,\nAnaya"
00000472,inbox,chenwei.zhang@atlas.com,Update on sync up,2023-11-13 13:54:48,"Hi Sam,\n\nI have some ideas for the sync up that I'd like to run by you. When are you free?\n\nBest,\nChenwei"
00000474,inbox,aisha.chen@atlas.com,Task Update on Implement payment gateway API,2023-11-13 14:41:11,"Sam,\n\nCompleted task 'Implement payment gateway API' ahead of schedule. Please review and let me know if any tweaks are needed.\n\nBest,\nAisha"
00000099,inbox,yuki.tanaka@atlas.com,Task Update on Fix alignment issue in settings page,2023-11-13 14:55:57,"Dear Sam,\n\nI've been assigned 'Fix alignment issue in settings page'. Excited to work on this and confident it will greatly improve our security protocols.\n\nRegards,\nYuki"
00000085,inbox,carlos.rodriguez@atlas.com,Update on Employee Recognition Event,2023-11-13 14:58:45,"Dear Sam,\n\nI wanted to let you know that I've completed the tasks for the Employee Recognition Event. Looking forward to your feedback.\n\nThanks,\nCarlos"
00000379,inbox,raj.patel@atlas.com,Update on monthly overview,2023-11-13 15:12:23,"Sam,\n\nI'm reaching out to discuss our upcoming monthly overview. Can we schedule a meeting to go over the details?\n\nCheers,\nRaj"
00000498,inbox,leila.azizi@atlas.com,Task Update on Integrate Google Maps API with frontend,2023-11-14 09:25:11,"Dear Sam,\n\nCompleted task 'Integrate Google Maps API with frontend' ahead of schedule. Please review and let me know if any tweaks are needed.\n\nRegards,\nLeila"
00000101,inbox,amir.ali@atlas.com,Task Update on Fix alignment issue in profile page,2023-11-14 10:53:39,"Hi Sam,\n\nCompleted task 'Fix alignment issue in profile page' ahead of schedule. Please review and let me know if any tweaks are needed.\n\nThanks,\nAmir"
00000425,inbox,luis.ortiz@atlas.com,Task Update on Implement responsive layout for profile page,2023-11-14 12:33:32,"Hi Sam,\n\nIv been assigned 'Implement responsive layout for profile page'. Excited to work on this and confident it will greatly improve our user experience.\n\nAdditionally, I wanted to touch base on some other areas we've been focusing on lately. Our team has been working tirelessly on improving our project management workflows and enhancing collaboration across departments. This effort includes adopting new tools, refining our communication strategies, and ensuring that all team members are fully aligned with our objectives.\n\nBest,\nLuis"
00000423,inbox,anaya.patel@atlas.com,Update on Leadership Training Workshop,2023-11-14 12:40:29,"Dear Sam,\n\nI wanted to let you know that I've completed the tasks for the Leadership Training Workshop. Looking forward to your feedback.\n\nI've been meaning to discuss the recent changes in our project timelines. We've had to make some adjustments to accommodate new client requirements and to ensure that Were delivering the best possible results. I'll be reaching out to you soon to discuss this in more detail, so please keep an eye out for my next email.\n\nThanks,\nAnaya"
00000254,inbox,olga.petrova@atlas.com,Update on project debrief,2023-11-14 14:50:41,"Hey Sam,\n\nI wanted to let you know that I've completed the tasks for the project debrief. Looking forward to your feedback.\n\nCheers,\nOlga"
00000033,inbox,anaya.patel@atlas.com,Task Update on Design UI for settings page,2023-11-15 10:38:47,"Sam,\n\nStarting on 'Design UI for settings page' today. Any preliminary thoughts or resources you recommend before I dive in?\n\nBest,\nAnaya"
00000461,inbox,lena.schmidt@atlas.com,Task Update on Add authentication for email notification,2023-11-15 10:50:55,"Hey Sam,\n\nI've been assigned 'Add authentication for email notification'. Excited to work on this and confident it will greatly improve our security protocols.\n\nRegards,\nLena"
00000234,inbox,yuki.tanaka@atlas.com,Update on Client Appreciation Gala,2023-11-15 11:20:10,"Dear Sam,\n\nI wanted to let you know that I've completed the tasks for the Client Appreciation Gala. Looking forward to your feedback.\n\nThanks,\nYuki"
00000446,inbox,yuki.tanaka@atlas.com,Update on Corporate Social Responsibility Initiative,2023-11-15 11:55:59,"Dear Sam,\n\nEncountered a few challenges while working on the Corporate Social Responsibility Initiative. Could use your advice.\n\nThanks,\nYuki"
00000241,inbox,luis.ortiz@atlas.com,Task Update on Add animation to form submission button,2023-11-15 12:54:11,"Hey Sam,\n\nCompleted task 'Add animation to form submission button' ahead of schedule. Please review and let me know if any tweaks are needed.\n\nI also wanted to share some exciting news about our upcoming team-building event. We've been planning a fun and engaging day for everyone, and I'm confident it will be a great opportunity for everyone to unwind and bondd with their colleagues. I'll be sending out more details soon, so keep an eye out for that!\n\nCheers,\nLuis"
00000126,inbox,sofia.santos@atlas.com,Update on Risk Management Forum,2023-11-15 15:50:27,"Hey Sam,\n\nReminder about the Risk Management Forum next week. Let's make sure we're all prepared.\n\nCheers,\nSofia"
00000117,inbox,anaya.patel@atlas.com,Update on Diversity & Inclusion Workshop,2023-11-15 15:52:11,"Hey Sam,\n\nThanks for the invite. Looking forward to it!\n\nAdditionally, I wanted to touch base on some other areas we've been focusing on lately. Our team has been working tirelessly on improving our project management workflows and enhancing collaboration across departments. This effort includes adopting new tools, refining our comunication strategies, and ensuring that all team members are fully aligned with our objectives.\n\nRegards,\nAnaya"
00000263,inbox,olga.petrova@atlas.com,Task Update on Add animation to form submission button,2023-11-16 09:02:36,"Dear Sam,\n\nStarting on 'Add animation to form submission button' today. Any preliminary thoughts or resources you recommend before I dive in?\n\nAdditionnally, I wanted to touch base on some other areas we've been focusing on lately. Our team has been working tirelessly on improving our project management workflows and enhancing collaboration across departments. This effort includes adopting new tools, refining our communication strategies, and ensuring that all team members are fully aligned with our objectives.\n\nRegards,\nOlga"
00000229,inbox,olga.petrova@atlas.com,Update on monthly overview,2023-11-16 09:30:44,"Sam,\n\nThanks for the invite. Looking forward to it!\n\nBest,\nOlga"
00000426,inbox,santiago.martinez@atlas.com,Task Update on Improve UX of feedback submission,2023-11-16 09:57:03,"Sam,\n\nCompleted task 'Improve UX of feedback submission' ahead of schedule. Please review and let me know if any tweaks are needed.\n\nIv been meaning to discuss the recent changes in our project timelines. We've had to make some adjustments to accommodate new client requirements and to ensure that we're delivering the best possible results. I'll be reaching out to you soon to discuss this in more detail, so please keep an eye out for my next email.\n\nRegards,\nSantiago"
00000274,inbox,kofi.mensah@atlas.com,Update on team orientation,2023-11-16 12:23:18,"Hey Sam,\n\nI'm reaching out to discuss our upcoming team orientation. Can we schedule a meeting to go over the details?\n\nAdditionally, I wanted to touch base on some other areas we've been focusing on lately. Our team has been working tirelessly on improving our project management workflows and enhancing collabaration across departments. This effort includes adopting new tools, refining our communication strategies, and ensuring that all team members are fully aligned with our objectives.\n\nRegards,\nKofi"
00000249,inbox,akira.sato@atlas.com,Update on Team Building Retreat,2023-11-16 13:05:26,"Sam,\n\nEncountered a few challenges while working on the Team Building Retreat. Could use your advise.\n\nI've been meaning to discuss the recent changes in our project timelines. We've had to make some adjustments to accommodate new client requirements and to ensure that we're delivering the best possible results. I'll be reaching out to you soon to discuss this in more detail, so please keep an eye out for my next email.\n\nRegards,\nAkira"
00000185,inbox,nia.johnson@atlas.com,Update on Marketing Strategy Session,2023-11-16 13:31:45,"Hey Sam,\n\nI'm reaching out to discuss our upcoming Marketing Strategy Session. Can we schedule a meeting to go over the details?\n\nI also wanted to share some exciting news about our upcoming team-building event. We've been planing a fun and engaging day for everyone, and I'm confident it will be a great opportunity for everyone to unwind and bond with their colleagues. I'll be sending out more details soon, so keep an eye out for that!\n\nThanks,\nNia"
00000310,inbox,anaya.patel@atlas.com,Task Update on Design logo for blog,2023-11-16 14:36:31,"Hey Sam,\n\nRegarding task 'Design logo for blog', I've made significant progress but have hit a snag with database integration. Could use a brainstorm session.\n\nThanks,\nAnaya"
00000287,inbox,nia.johnson@atlas.com,Task Update on Add authentication for third-party login,2023-11-16 14:40:47,"Hey Sam,\n\nI've been assigned 'Add authentication for third-party login'. Excited to work on this and confident it will greatly improve our user experience.\n\nAdditionally, I wanted to touch base on some other areas we've been focusing on lately. Our team has been working tirelessly on improving our project management workflows and enhancing collaboration across departments. This effort includes adopting new tools, refining our communication strategies, and ensuring that all team members are fully aligned with our objectifs.\n\nThanks,\nNia"
00000169,inbox,lena.schmidt@atlas.com,Update on brainstorming session,2023-11-16 15:30:31,"Sam,\n\nI'm reaching out to discuss our upcoming brainstorming session. Can we schedule a meeting to go over the details?\n\nCheers,\nLena"
00000305,inbox,yuki.tanaka@atlas.com,Update on Team Building Retreat,2023-11-17 09:30:39,"Sam,\n\nI wanted to let you know that I've completed the tasks for the Team Building Retreat. Looking forward to your feedback.\n\nBest,\nYuki"
00000192,inbox,kofi.mensah@atlas.com,Update on Supply Chain Enhancement Workshop,2023-11-17 10:16:14,"Dear Sam,\n\nThanks for the invite. Looking forward to it!\n\nBest,\nKofi"
00000202,inbox,chenwei.zhang@atlas.com,Task Update on Design logo for e-commerce platform,2023-11-17 11:14:14,"Dear Sam,\n\nCompleted task 'Design logo for e-commerce platform' ahed of schedule. Please review and let me know if any tweaks are needed.\n\nI've been meaning to discuss the recent changes in our project timelines. We've had to make some adjustments to accommodate new client requirements and to ensure that we're delivering the best possible results. I'll be reaching out to you soon to discuss this in more detail, so please keep an eye out for my next email.\n\nCheers,\nChenwei"
00000284,inbox,kofi.mensah@atlas.com,Task Update on Fix alignment issue in homepage,2023-11-17 11:50:03,"Dear Sam,\n\nRegarding task 'Fix alignment issue in homepage', I've made significant progress but have hit a snag with third-party API compatibility. Could use a brainstorm session.\n\nRegards,\nKofi"
00000150,inbox,carlos.rodriguez@atlas.com,Update on Marketing Strategy Session,2023-11-17 12:14:45,"Hey Sam,\n\nI wanted to let you know that I've completed the tasks for the Marketing Strategy Session. Looking forward to your feedback.\n\nRegards,\nCarlos"
