email_id,inbox/outbox,sender/recipient,subject,sent_datetime,body
00000303,inbox,luis.ortiz@atlas.com,Update on sync up,2023-10-29 12:59:22,"Hey Sam,\n\nI'm reaching out to discuss our upcoming sync up. Can we schedule a meeting to go over the details?\n\nThanks,\nLuis"
00000177,inbox,jinsoo.kim@atlas.com,Task Update on Design UI for landing page,2023-10-29 13:33:47,"Dear Sam,\n\nI've been assigned 'Design UI for landing page'. Excited to work on this and confident it will greatly improve our user experience.\n\nCheers,\nJinsoo"
00000451,inbox,sofia.santos@atlas.com,Update on Creative Thinking Workshop,2023-10-29 13:58:48,"Hey Sam,\n\nI have some ideas for the Creative Thinking Workshop that I'd like to run by you. When are you free?\n\nThanks,\nSofia"
00000184,inbox,akira.sato@atlas.com,Update on Marketing Strategy Session,2023-10-29 14:28:23,"Dear Sam,\n\nThanks for the invite. Looking forward to it!\n\nAdditionally, I wanted to touch base on some other areas we've been focusing on lately. Our team has been working tirelessly on improving our project management workflows and enhancing collabaration across departments. This effort includes adopting new tools, refining our communication strategies, and ensuring that all team members are fully aligned with our objectives.\n\nThanks,\nAkira"
00000371,inbox,dmitri.ivanov@atlas.com,Update on quarterly tech roundup,2023-10-29 15:41:03,"Dear Sam,\n\nCould you provide your input on the quarterly tech roundup planning? Your insights would be really valuable.\n\nRegards,\nDmitri"
00000418,inbox,akira.sato@atlas.com,Task Update on Optimize database query for user management,2023-10-30 09:04:32,"Sam,\n\nCompleted task 'Optimize database query for user management' ahead of schedule. Please review and let me know if any tweaks are needed.\n\nCheers,\nAkira"
00000339,inbox,aisha.chen@atlas.com,Update on Leadership Training Workshop,2023-10-30 10:29:17,"Sam,\n\nCould you provide your input on the Leadership Training Workshop planning? Your insights would be really valuable.\n\nI've been meaning to discuss the recent changes in our project timelines. We've had to make some adjustments to acommodate new client requirements and to ensure that we're delivering the best possible results. I'll be reaching out to you soon to discuss this in more detail, so please keep an eye out for my next email.\n\nCheers,\nAisha"
00000212,inbox,nadia.moreau@atlas.com,Task Update on Update brand colors in website,2023-10-30 10:46:25,"Sam,\n\nI've been assigned 'Update brand colors in website'. Excited to work on this and confident it will greatly improve our user experience.\n\nRegards,\nNadia"
00000399,inbox,leila.azizi@atlas.com,Update on feedback discussion,2023-10-30 11:23:25,"Hey Sam,\n\nEncountered a few challenges while working on the feedback discussion. Could use your advice.\n\nI also wanted to share some exciting news about our upcoming team-building event. We've been planing a fun and engaging day for everyone, and I'm confident it will be a great opportunity for everyone to unwind and bond with their colleagues. I'll be sending out more details soon, so keep an eye out for that!\n\nRegards,\nLeila"
00000064,inbox,anaya.patel@atlas.com,Update on Quarterly Sales Review,2023-10-30 12:11:37,"Hi Sam,\n\nCould you provide your input on the Quarterly Sales Review planning? Your insights would be really valuable.\n\nRegards,\nAnaya"
00000493,inbox,leila.azizi@atlas.com,Task Update on Add animation to form submission button,2023-10-30 12:48:19,"Sam,\n\nCompleted task 'Add animation to form submission button' ahead of schedule. Please review and let me know if any tweaks are needed.\n\nRegards,\nLeila"
00000442,inbox,santiago.martinez@atlas.com,Update on Product Launch Analysis,2023-10-30 13:31:53,"Dear Sam,\n\nCould you provide your input on the Product Launch Analysis planning? Your insights would be really valuable.\n\nRegards,\nSantiago"
00000130,inbox,anaya.patel@atlas.com,Task Update on Implement payment gateway API,2023-10-30 13:44:43,"Hi Sam,\n\nCompleted task 'Implement payment gateway API' ahead of schedule. Please review and let me know if any tweaks are needed.\n\nRegards,\nAnaya"
00000136,inbox,kofi.mensah@atlas.com,Update on Supply Chain Enhancement Workshop,2023-10-30 14:11:38,"Dear Sam,\n\nThanks for the invite. Looking forward to it!\n\nBest,\nKofi"
00000112,inbox,anaya.patel@atlas.com,Update on Annual Budget Planning Session,2023-10-30 15:08:56,"Hi Sam,\n\nI'm reaching out to discuss our upcoming Annual Budget Planning Session. Can we schedule a meeting to go over the details?\n\nRegards,\nAnaya"
00000055,inbox,santiago.martinez@atlas.com,Task Update on Update react to latest version,2023-10-30 15:16:07,"Dear Sam,\n\nCompleted task 'Update react to latest version' ahead of schedule. Please review and let me know if any tweaks are needed.\n\nCheers,\nSantiago"
00000090,inbox,kofi.mensah@atlas.com,Update on status briefing,2023-10-30 15:17:59,"Sam,\n\nI wanted to let you know that I've completed the tasks for the status briefing. Looking forward to your feedback.\n\nThanks,\nKofi"
00000075,inbox,aisha.chen@atlas.com,Task Update on Develop prototype for login system,2023-10-31 10:05:08,"Sam,\n\nI've been assigned 'Develop prototype for login system'. Excited to work on this and confident it will greatly improve our security protocols.\n\nThanks,\nAisha"
00000285,inbox,dmitri.ivanov@atlas.com,Task Update on Optimize database query for search functionality,2023-10-31 10:32:01,"Hey Sam,\n\nStarting on 'Optimize database query for search functionality' today. Any preliminary thoughts or resources you recommend before I dive in?\n\nBest,\nDmitri"
00000384,inbox,nadia.moreau@atlas.com,Update on retrospective meeting,2023-10-31 13:41:37,"Hey Sam,\n\nI have some ideas for the retrospective meeting that I'd like to run by you. When are you free?\n\nI've been meaning to discuss the recent changes in our project timelines. We've had to make some adjustments to accommodate new client requirements and to ensure that Were delivering the best possible results. I'll be reaching out to you soon to discuss this in more detail, so please keep an eye out for my next email.\n\nBest,\nNadia"
00000483,inbox,yuki.tanaka@atlas.com,Task Update on Implement user profile management API,2023-10-31 14:12:08,"Dear Sam,\n\nIv been assigned 'Implement user profile management API'. Excited to work on this and confident it will greatly improve our security protocols.\n\nI also wanted to share some exciting news about our upcoming team-building event. We've been planning a fun and engaging day for everyone, and I'm confident it will be a great opportunity for everyone to unwind and bond with their colleagues. I'll be sending out more details soon, so keep an eye out for that!\n\nRegards,\nYuki"
00000065,inbox,fatima.khan@atlas.com,Task Update on Add authentication for email notification,2023-11-01 09:38:27,"Dear Sam,\n\nCompleted task 'Add authentication for email notification' ahead of schedule. Please review and let me know if any tweaks are needed.\n\nCheers,\nFatima"
00000190,inbox,aisha.chen@atlas.com,Update on team coordination meeting,2023-11-01 10:58:49,"Hey Sam,\n\nI wanted to let you know that I've completed the tasks for the team coordination meeting. Looking forward to your feedback.\n\nThanks,\nAisha"
00000174,inbox,chenwei.zhang@atlas.com,Task Update on Update react to latest version,2023-11-01 12:04:12,"Dear Sam,\n\nCompleted task 'Update react to latest version' ahead of schedule. Please review and let me know if any tweaks are needed.\n\nI also wanted to share some exciting news about our upcomming team-building event. We've been planning a fun and engaging day for everyone, and I'm confident it will be a great opportunity for everyone to unwind and bond with their colleagues. I'll be sending out more details soon, so keep an eye out for that!\n\nBest,\nChenwei"
00000167,inbox,nadia.moreau@atlas.com,Task Update on Design UI for landing page,2023-11-01 12:08:12,"Sam,\n\nStarting on 'Design UI for landing page' today. Any preliminary thoughts or resources you recommend before I dive in?\n\nBest,\nNadia"
00000233,inbox,raj.patel@atlas.com,Task Update on Develop prototype for payment gateway,2023-11-01 13:35:08,"Dear Sam,\n\nI've been assigned 'Develop prototype for payment gateway'. Excited to work on this and confident it will greatly improve our backend efficiency.\n\nThanks,\nRaj"
00000171,inbox,amir.ali@atlas.com,Task Update on Design logo for website,2023-11-01 14:23:05,"Hey Sam,\n\nCompleted task 'Design logo for website' ahead of schedule. Please review and let me know if any tweaks are needed.\n\nRegards,\nAmir"
00000430,inbox,santiago.martinez@atlas.com,Task Update on Update brand colors in website,2023-11-01 15:41:26,"Dear Sam,\n\nRegarding task 'Update brand colors in website', I've made significant progress but have hit a snag with database integration. Could use a brainstorm session.\n\nBest,\nSantiago"
00000447,inbox,yuki.tanaka@atlas.com,Update on Corporate Social Responsibility Initiative,2023-11-01 15:53:31,"Dear Sam,\n\nEncountered a few challenges while working on the Corporate Social Responsibility Initiative. Could use your advice.\n\nThanks,\nYuki"
00000029,inbox,anaya.patel@atlas.com,Update on process review,2023-11-02 09:34:09,"Hey Sam,\n\nReminder about the process review next week. Let's make sure we're all prepared.\n\nCheers,\nAnaya"
00000045,inbox,luis.ortiz@atlas.com,Task Update on Fix bug in content delivery module,2023-11-02 10:30:29,"Dear Sam,\n\nRegarding task 'Fix bug in content delivery module', I've made significant progress but have hit a snag with third-party API compatibility. Could use a brainstorm session.\n\nBest,\nLuis"
00000463,inbox,akira.sato@atlas.com,Update on feedback discussion,2023-11-02 14:29:47,"Sam,\n\nEncountered a few challenges while working on the feedback discussion. Could use your advice.\n\nThanks,\nAkira"
00000380,inbox,leila.azizi@atlas.com,Task Update on Integrate Google Maps API with frontend,2023-11-02 15:52:50,"Sam,\n\nCompleted task 'Integrate Google Maps API with frontend' ahead of schedule. Please review and let me know if any tweaks are needed.\n\nCheers,\nLeila"
00000080,inbox,nadia.moreau@atlas.com,Update on Year-End Performance Assessment,2023-11-03 09:04:55,"Hey Sam,\n\nCould you provide your input on the Year-End Performance Assessment planing? Your insights would be really valuable.\n\nAdditionally, I wanted to touch base on some other areas we've been focusing on lately. Our team has been working tirelessly on improving our project management workflows and enhancing collaboration across departments. This effort includes adopting new tools, refining our communication strategies, and ensuring that all team members are fully aligned with our objectives.\n\nBest,\nNadia"
00000148,inbox,lena.schmidt@atlas.com,Update on Digital Transformation Conference,2023-11-03 09:11:07,"Sam,\n\nReminder about the Digital Transformation Conference next week. Let's make sure we're all prepared.\n\nI also wanted to share some exciting news about our upcoming team-building event. We've been planing a fun and engaging day for everyone, and I'm confident it will be a great opportunity for everyone to unwind and bond with their colleagues. I'll be sending out more details soon, so keep an eye out for that!\n\nThanks,\nLena"
00000002,inbox,chenwei.zhang@atlas.com,Update on IT Systems Update Briefing,2023-11-03 11:38:45,"Dear Sam,\n\nEncountered a few challenges while working on the IT Systems Update Briefing. Could use your advice.\n\nThanks,\nChenwei"
00000311,inbox,kofi.mensah@atlas.com,Task Update on Design logo for website,2023-11-03 12:49:14,"Dear Sam,\n\nCompleted task 'Design logo for website' ahead of schedule. Please review and let me know if any tweaks are needed.\n\nCheers,\nKofi"
00000163,inbox,luis.ortiz@atlas.com,Task Update on Develop prototype for login system,2023-11-03 13:34:02,"Dear Sam,\n\nStarting on 'Develop prototype for login system' today. Any preliminary thoughts or resources you recommend before I dive in?\n\nCheers,\nLuis"
00000497,inbox,chenwei.zhang@atlas.com,Task Update on Fix alignment issue in homepage,2023-11-03 13:35:33,"Hey Sam,\n\nI've been assigned 'Fix alignment issue in homepage'. Excited to work on this and confident it will greatly improve our security protocols.\n\nI also wanted to share some exciting news about our upcoming team-building event. We've been planning a fun and engagging day for everyone, and I'm confident it will be a great opportunity for everyone to unwind and bond with their colleagues. I'll be sending out more details soon, so keep an eye out for that!\n\nRegards,\nChenwei"
00000251,inbox,olga.petrova@atlas.com,Task Update on Add animation to form submission button,2023-11-03 13:41:25,"Dear Sam,\n\nStarting on 'Add animation to form submission button' today. Any preliminary thoughts or resources you recommend before I dive in?\n\nAdditionnally, I wanted to touch base on some other areas we've been focusing on lately. Our team has been working tirelessly on improving our project management workflows and enhancing collaboration across departments. This effort includes adopting new tools, refining our communication strategies, and ensuring that all team members are fully aligned with our objectives.\n\nRegards,\nOlga"
00000027,inbox,fatima.khan@atlas.com,Update on team evaluation,2023-11-03 13:46:49,"Sam,\n\nI have some ideas for the team evaluation that I'd like to run by you. When are you free?\n\nCheers,\nFatima"
00000038,inbox,leila.azizi@atlas.com,Task Update on Fix bug in content delivery module,2023-11-03 14:07:30,"Sam,\n\nCompleted task 'Fix bug in content delivery module' ahead of schedule. Please review and let me know if any tweaks are needed.\n\nBest,\nLeila"
00000345,inbox,chenwei.zhang@atlas.com,Update on sync up,2023-11-03 15:41:30,"Hey Sam,\n\nI'm reaching out to discuss our upcoming sync up. Can we schedule a meeting to go over the details?\n\nCheers,\nChenwei"
00000364,inbox,nia.johnson@atlas.com,Update on Creative Thinking Workshop,2023-11-04 09:09:59,"Hey Sam,\n\nThanks for the invite. Looking forward to it!\n\nRegards,\nNia"
00000087,inbox,anaya.patel@atlas.com,Update on weekly summary,2023-11-04 09:26:57,"Hi Sam,\n\nI wanted to let you know that I've completed the tasks for the weekly summary. Looking forward to your feedback.\n\nBest,\nAnaya"
00000243,inbox,kofi.mensah@atlas.com,Update on Supply Chain Enhancement Workshop,2023-11-04 11:49:03,"Dear Sam,\n\nThanks for the invite. Looking forward to it!\n\nBest,\nKofi"
00000352,inbox,amir.ali@atlas.com,Task Update on Design logo for blog,2023-11-04 13:27:04,"Dear Sam,\n\nRegarding task 'Design logo for blog', I've made significant progress but have hit a snag with third-party API compatibility. Could use a brainstorm session.\n\nAdditionnally, I wanted to touch base on some other areas we've been focusing on lately. Our team has been working tirelessly on improving our project management workflows and enhancing collaboration across departments. This effort includes adopting new tools, refining our communication strategies, and ensuring that all team members are fully aligned with our objectives.\n\nThanks,\nAmir"
00000441,inbox,anaya.patel@atlas.com,Task Update on Design UI for landing page,2023-11-04 13:27:29,"Sam,\n\nI've been assigned 'Design UI for landing page'. Excited to work on this and confident it will greatly improve our user experience.\n\nBest,\nAnaya"
00000244,inbox,nadia.moreau@atlas.com,Task Update on Develop prototype for login system,2023-11-04 14:33:38,"Dear Sam,\n\nStarting on 'Develop prototype for login system' today. Any preliminary thoughts or resources you recommend before I dive in?\n\nI also wanted to share some exciting news about our upcomming team-building event. We've been planning a fun and engaging day for everyone, and I'm confident it will be a great opportunity for everyone to unwind and bond with their colleagues. I'll be sending out more details soon, so keep an eye out for that!\n\nBest,\nNadia"
00000496,inbox,kofi.mensah@atlas.com,Update on team coordination meeting,2023-11-05 09:05:54,"Hey Sam,\n\nCould you provide your input on the team coordination meeting planning? Your insights would be really valuable.\n\nI've been meaning to discuss the recent changes in our project timelines. We've had to make some adjustments to accommodate new client requirements and to ensure that Were delivering the best possible results. I'll be reaching out to you soon to discuss this in more detail, so please keep an eye out for my next email.\n\nRegards,\nKofi"
00000312,inbox,carlos.rodriguez@atlas.com,Update on project checkpoint,2023-11-05 09:27:41,"Hey Sam,\n\nEncountered a few challenges while working on the project checkpoint. Could use your advise.\n\nI also wanted to share some exciting news about our upcoming team-building event. We've been planning a fun and engaging day for everyone, and I'm confident it will be a great opportunity for everyone to unwind and bond with their colleagues. I'll be sending out more details soon, so keep an eye out for that!\n\nBest,\nCarlos"
00000004,inbox,aisha.chen@atlas.com,Task Update on Create wireframe for homepage,2023-11-05 12:34:06,"Sam,\n\nCompleted task 'Create wireframe for homepage' ahead of schedule. Please review and let me know if any tweaks are needed.\n\nI also wanted to share some exciting news about our upcoming team-building event. We've been planning a fun and engaging day for everyone, and I'm confident it will be a great oppurtunity for everyone to unwind and bond with their colleagues. I'll be sending out more details soon, so keep an eye out for that!\n\nCheers,\nAisha"
00000088,inbox,yuki.tanaka@atlas.com,Task Update on Develop prototype for payment gateway,2023-11-05 12:41:57,"Dear Sam,\n\nCompleted task 'Develop prototype for payment gateway' ahead of schedule. Please review and let me know if any tweaks are needed.\n\nBest,\nYuki"
00000362,inbox,dmitri.ivanov@atlas.com,Task Update on Optimize database query for report generation,2023-11-05 12:58:55,"Dear Sam,\n\nI've been assigned 'Optimize database query for report generation'. Excited to work on this and confident it will greatly improve our backend efficiency.\n\nCheers,\nDmitri"
00000109,inbox,raj.patel@atlas.com,Update on status briefing,2023-11-05 13:43:51,"Dear Sam,\n\nReminder about the status briefing next week. Let's make sure we're all prepared.\n\nThanks,\nRaj"
00000449,inbox,aisha.chen@atlas.com,Update on performance evaluation,2023-11-05 14:11:30,"Dear Sam,\n\nI have some ideas for the performance evaluation that I'd like to run by you. When are you free?\n\nThanks,\nAisha"
00000220,inbox,jinsoo.kim@atlas.com,Task Update on Add authentication for email notification,2023-11-05 14:55:20,"Dear Sam,\n\nI've been assigned 'Add authentication for email notification'. Excited to work on this and confident it will greatly improve our backend efficiency.\n\nRegards,\nJinsoo"
00000037,inbox,nia.johnson@atlas.com,Task Update on Add animation to carousel,2023-11-05 15:32:53,"Dear Sam,\n\nStarting on 'Add animation to carousel' today. Any preliminary thoughts or resources you recommend before I dive in?\n\nBest,\nNia"
00000123,inbox,olga.petrova@atlas.com,Update on monthly overview,2023-11-06 09:39:24,"Dear Sam,\n\nCould you provide your input on the monthly overview planing? Your insights would be really valuable.\n\nAdditionally, I wanted to touch base on some other areas we've been focusing on lately. Our team has been working tirelessly on improving our project management workflows and enhancing collaboration across departments. This effort includes adopting new tools, refining our communication strategies, and ensuring that all team members are fully aligned with our objectives.\n\nThanks,\nOlga"
00000197,inbox,amir.ali@atlas.com,Task Update on Update brand colors in website,2023-11-06 11:48:21,"Sam,\n\nRegarding task 'Update brand colors in website', I've made significant progress but have hit a snag with third-party API compatibility. Could use a brainstorm session.\n\nBest,\nAmir"
00000001,inbox,raj.patel@atlas.com,Update on IT Systems Update Briefing,2023-11-06 13:10:35,"Hi Sam,\n\nI have some ideas for the IT Systems Update Briefing that I'd like to run by you. When are you free?\n\nBest,\nRaj"
00000301,inbox,fatima.khan@atlas.com,Update on project checkpoint,2023-11-06 13:37:21,"Sam,\n\nI'm reaching out to discuss our upcoming project checkpoint. Can we schedule a meeting to go over the details?\n\nThanks,\nFatima"
00000313,inbox,dmitri.ivanov@atlas.com,Update on team coordination meeting,2023-11-06 14:14:50,"Hi Sam,\n\nI wanted to let you know that Iv completed the tasks for the team coordination meeting. Looking forward to your feedback.\n\nIv been meaning to discuss the recent changes in our project timelines. We've had to make some adjustments to accommodate new client requirements and to ensure that we're delivering the best possible results. I'll be reaching out to you soon to discuss this in more detail, so please keep an eye out for my next email.\n\nThanks,\nDmitri"
00000490,inbox,dmitri.ivanov@atlas.com,Task Update on Optimize database query for user management,2023-11-06 15:56:59,"Hi Sam,\n\nCompleted task 'Optimize database query for user management' ahead of schedule. Please review and let me know if any tweaks are needed.\n\nI've been meaning to discuss the recentt changes in our project timelines. We've had to make some adjustments to accommodate new client requirements and to ensure that we're delivering the best possible results. I'll be reaching out to you soon to discuss this in more detail, so please keep an eye out for my next email.\n\nRegards,\nDmitri"
00000468,inbox,lena.schmidt@atlas.com,Task Update on Optimize database query for user management,2023-11-07 09:12:27,"Hey Sam,\n\nI've been assigned 'Optimize database query for user management'. Excited to work on this and confident it will greatly improve our backend efficiency.\n\nI've been meaning to discuss the recent changes in our project timelines. We've had to make some adjustments to acommodate new client requirements and to ensure that we're delivering the best possible results. I'll be reaching out to you soon to discuss this in more detail, so please keep an eye out for my next email.\n\nRegards,\nLena"
00000459,inbox,santiago.martinez@atlas.com,Update on process review,2023-11-07 11:52:53,"Hey Sam,\n\nI have some ideas for the process review that I'd like to run by you. When are you free?\n\nThanks,\nSantiago"
00000293,inbox,chenwei.zhang@atlas.com,Update on sync up,2023-11-07 12:40:31,"Hi Sam,\n\nI have some ideas for the sync up that I'd like to run by you. When are you free?\n\nBest,\nChenwei"
00000157,inbox,anaya.patel@atlas.com,Task Update on Add animation to form submission button,2023-11-07 15:03:31,"Hey Sam,\n\nRegarding task 'Add animation to form submission button', I've made significant progress but have hit a snag with database integration. Could use a brainstorm session.\n\nRegards,\nAnaya"
00000382,inbox,carlos.rodriguez@atlas.com,Task Update on Update react to latest version,2023-11-07 15:11:42,"Hi Sam,\n\nStarting on 'Update react to latest version' today. Any preliminary thoughts or resources you recommend before I dive in?\n\nBest,\nCarlos"
00000432,inbox,anaya.patel@atlas.com,Task Update on Add authentication for cloud storage,2023-11-08 09:09:07,"Hey Sam,\n\nRegarding task 'Add authentication for cloud storage', I've made significant progress but have hit a snag with database integration. Could use a brainstorm session.\n\nBest,\nAnaya"
00000105,inbox,amir.ali@atlas.com,Task Update on Design logo for e-commerce platform,2023-11-08 10:37:54,"Sam,\n\nI've been assigned 'Design logo for e-commerce platform'. Excited to work on this and confident it will greatly improve our security protocols.\n\nI also wanted to share some exciting news about our upcoming team-building event. We've been planning a fun and engaging day for everyone, and I'm confident it will be a great opportunity for everyone to unwind and bondd with their colleagues. I'll be sending out more details soon, so keep an eye out for that!\n\nThanks,\nAmir"
00000129,inbox,anaya.patel@atlas.com,Task Update on Develop prototype for payment gateway,2023-11-08 11:01:19,"Hey Sam,\n\nStarting on 'Develop prototype for payment gateway' today. Any preliminary thoughts or resources you recommend before I dive in?\n\nBest,\nAnaya"
00000338,inbox,nadia.moreau@atlas.com,Task Update on Improve UX of feedback submission,2023-11-08 11:31:12,"Sam,\n\nI've been assigned 'Improve UX of feedback submission'. Excited to work on this and confident it will greatly improve our security protocols.\n\nRegards,\nNadia"
00000058,inbox,amir.ali@atlas.com,Task Update on Design logo for website,2023-11-08 11:36:48,"Hey Sam,\n\nCompleted task 'Design logo for website' ahead of schedule. Please review and let me know if any tweaks are needed.\n\nRegards,\nAmir"
00000091,inbox,raj.patel@atlas.com,Update on process review,2023-11-08 12:31:16,"Sam,\n\nEncountered a few challenges while working on the process review. Could use your advice.\n\nThanks,\nRaj"
00000056,inbox,fatima.khan@atlas.com,Task Update on Update Django to latest version,2023-11-08 12:33:22,"Hey Sam,\n\nI've been assigned 'Update Django to latest version'. Excited to work on this and confident it will greatly improve our backend efficiency.\n\nCheers,\nFatima"
00000385,inbox,fatima.khan@atlas.com,Update on introductory call,2023-11-08 12:53:35,"Hey Sam,\n\nCould you provide your input on the introductory call planning? Your insights would be really valuable.\n\nBest,\nFatima"
