email_id,inbox/outbox,sender/recipient,subject,sent_datetime,body
00000373,inbox,santiago.martinez@atlas.com,Task Update on Develop prototype for payment gateway,2023-10-01 09:15:02,"Sam,\n\nCompleted task 'Develop prototype for payment gateway' ahead of schedule. Please review and let me know if any tweaks are needed.\n\nBest,\nSantiago"
00000353,inbox,chenwei.zhang@atlas.com,Update on Annual Budget Planning Session,2023-10-01 09:40:01,"Sam,\n\nEncountered a few challenges while working on the Annual Budget Planning Session. Could use your advice.\n\nCheers,\nChenwei"
00000013,inbox,kofi.mensah@atlas.com,Task Update on Fix alignment issue in homepage,2023-10-01 10:50:46,"Dear Sam,\n\nRegarding task 'Fix alignment issue in homepage', I've made significant progress but have hit a snag with third-party API compatibility. Could use a brainstorm session.\n\nRegards,\nKofi"
00000103,inbox,chenwei.zhang@atlas.com,Update on Quarterly Sales Review,2023-10-01 10:58:07,"Hey Sam,\n\nEncountered a few challenges while working on the Quarterly Sales Review. Could use your advice.\n\nThanks,\nChenwei"
00000295,inbox,nadia.moreau@atlas.com,Update on Year-End Performance Assessment,2023-10-01 11:37:37,"Hey Sam,\n\nCould you provide your input on the Year-End Performance Assessment planing? Your insights would be really valuable.\n\nAdditionally, I wanted to touch base on some other areas we've been focusing on lately. Our team has been working tirelessly on improving our project management workflows and enhancing collaboration across departments. This effort includes adopting new tools, refining our communication strategies, and ensuring that all team members are fully aligned with our objectives.\n\nBest,\nNadia"
00000230,inbox,santiago.martinez@atlas.com,Task Update on Fix alignment issue in profile page,2023-10-01 12:56:52,"Dear Sam,\n\nI've been assigned 'Fix alignment issue in profile page'. Excited to work on this and confident it will greatly improve our security protocols.\n\nBest,\nSantiago"
00000393,inbox,raj.patel@atlas.com,Update on Supply Chain Enhancement Workshop,2023-10-01 13:11:52,"Dear Sam,\n\nI have some ideas for the Supply Chain Enhancement Workshop that I'd like to run by you. When are you free?\n\nCheers,\nRaj"
00000082,inbox,chenwei.zhang@atlas.com,Task Update on Update react to latest version,2023-10-01 13:28:31,"Dear Sam,\n\nCompleted task 'Update react to latest version' ahead of schedule. Please review and let me know if any tweaks are needed.\n\nI also wanted to share some exciting news about our upcomming team-building event. We've been planning a fun and engaging day for everyone, and I'm confident it will be a great opportunity for everyone to unwind and bond with their colleagues. I'll be sending out more details soon, so keep an eye out for that!\n\nBest,\nChenwei"
00000377,inbox,raj.patel@atlas.com,Update on daily stand-up,2023-10-01 13:32:50,"Sam,\n\nI wanted to let you know that I've completed the tasks for the daily stand-up. Looking forward to your feedback.\n\nThanks,\nRaj"
00000146,inbox,aisha.chen@atlas.com,Task Update on Develop prototype for login system,2023-10-01 13:36:34,"Hi Sam,\n\nStarting on 'Develop prototype for login system' today. Any preliminary thoughts or resources you recommend before I dive in?\n\nCheers,\nAisha"
00000139,inbox,dmitri.ivanov@atlas.com,Update on sync up,2023-10-01 14:03:02,"Hi Sam,\n\nThanks for the invite. Looking forward to it!\n\nRegards,\nDmitri"
00000397,inbox,anaya.patel@atlas.com,Task Update on Implement payment gateway API,2023-10-01 14:21:55,"Hi Sam,\n\nCompleted task 'Implement payment gateway API' ahead of schedule. Please review and let me know if any tweaks are needed.\n\nRegards,\nAnaya"
00000128,inbox,sofia.santos@atlas.com,Task Update on Update brand colors in website,2023-10-02 09:25:02,"Hey Sam,\n\nI've been assigned 'Update brand colors in website'. Excited to work on this and confident it will greatly improve our user experience.\n\nBest,\nSofia"
00000187,inbox,lena.schmidt@atlas.com,Update on Leadership Training Workshop,2023-10-02 10:31:52,"Sam,\n\nReminder about the Leadership Training Workshop next week. Let's make sure we're all prepared.\n\nThanks,\nLena"
00000411,inbox,lena.schmidt@atlas.com,Update on daily stand-up,2023-10-02 11:07:17,"Hey Sam,\n\nI have some ideas for the daily stand-up that I'd like to run by you. When are you free?\n\nThanks,\nLena"
00000317,inbox,akira.sato@atlas.com,Update on Marketing Strategy Session,2023-10-02 11:20:14,"Hi Sam,\n\nReminder about the Marketing Strategy Session next week. Let's make sure we're all prepared.\n\nBest,\nAkira"
00000261,inbox,akira.sato@atlas.com,Update on Creative Thinking Workshop,2023-10-02 12:10:02,"Hi Sam,\n\nI wanted to let you know that I've completed the tasks for the Creative Thinking Workshop. Looking forward to your feedback.\n\nThanks,\nAkira"
00000309,inbox,sofia.santos@atlas.com,Update on project debrief,2023-10-02 12:44:08,"Hi Sam,\n\nEncountered a few challenges while working on the project debrief. Could use your advise.\n\nI've been meaning to discuss the recent changes in our project timelines. We've had to make some adjustments to accommodate new client requirements and to ensure that we're delivering the best possible results. I'll be reaching out to you soon to discuss this in more detail, so please keep an eye out for my next email.\n\nCheers,\nSofia"
00000491,inbox,luis.ortiz@atlas.com,Update on quarterly tech roundup,2023-10-02 13:51:20,"Sam,\n\nReminder about the quarterly tech roundup next week. Let's make sure we're all prepared.\n\nCheers,\nLuis"
00000164,inbox,olga.petrova@atlas.com,Task Update on Optimize database query for report generation,2023-10-02 14:46:33,"Dear Sam,\n\nRegarding task 'Optimize database query for report generation', I've made significant progress but have hit a snag with third-party API compatibility. Could use a brainstorm session.\n\nBest,\nOlga"
00000476,inbox,nia.johnson@atlas.com,Task Update on Implement user profile management API,2023-10-02 15:05:54,"Hi Sam,\n\nCompleted task 'Implement user profile management API' ahead of schedule. Please review and let me know if any tweaks are needed.\n\nBest,\nNia"
00000195,inbox,raj.patel@atlas.com,Update on Year-End Performance Assessment,2023-10-02 15:09:14,"Hey Sam,\n\nI have some ideas for the Year-End Performance Assessment that I'd like to run by you. When are you free?\n\nI also wanted to share some exciting news about our upcoming team-building event. We've been planning a fun and engaging day for everyone, and I'm confident it will be a great opportunity for everyone to unwindd and bond with their colleagues. I'll be sending out more details soon, so keep an eye out for that!\n\nCheers,\nRaj"
00000297,inbox,olga.petrova@atlas.com,Update on Marketing Strategy Session,2023-10-03 09:56:07,"Dear Sam,\n\nI wanted to let you know that I've completed the tasks for the Marketing Strategy Session. Looking forward to your feedback.\n\nRegards,\nOlga"
00000469,inbox,nia.johnson@atlas.com,Task Update on Fix alignment issue in homepage,2023-10-03 12:35:29,"Dear Sam,\n\nI've been assigned 'Fix alignment issue in homepage'. Excited to work on this and confident it will greatly improve our backend efficiency.\n\nThanks,\nNia"
00000096,inbox,olga.petrova@atlas.com,Update on monthly overview,2023-10-03 14:30:13,"Dear Sam,\n\nCould you provide your input on the monthly overview planing? Your insights would be really valuable.\n\nAdditionally, I wanted to touch base on some other areas we've been focusing on lately. Our team has been working tirelessly on improving our project management workflows and enhancing collaboration across departments. This effort includes adopting new tools, refining our communication strategies, and ensuring that all team members are fully aligned with our objectives.\n\nThanks,\nOlga"
00000014,inbox,santiago.martinez@atlas.com,Update on Quarterly Sales Review,2023-10-03 14:56:54,"Sam,\n\nI have some ideas for the Quarterly Sales Review that I'd like to run by you. When are you free?\n\nRegards,\nSantiago"
00000304,inbox,santiago.martinez@atlas.com,Update on Year-End Performance Assessment,2023-10-04 09:39:05,"Dear Sam,\n\nI have some ideas for the Year-End Performance Assessment that I'd like to run by you. When are you free?\n\nThanks,\nSantiago"
00000481,inbox,olga.petrova@atlas.com,Update on Client Appreciation Gala,2023-10-04 09:48:15,"Hey Sam,\n\nI wanted to let you know that I've completed the tasks for the Client Appreciation Gala. Looking forward to your feedback.\n\nI've been meaning to discuss the recent changes in our project timelines. We've had to make some adjusments to accommodate new client requirements and to ensure that we're delivering the best possible results. I'll be reaching out to you soon to discuss this in more detail, so please keep an eye out for my next email.\n\nBest,\nOlga"
00000434,inbox,amir.ali@atlas.com,Task Update on Fix alignment issue in settings page,2023-10-04 10:05:56,"Dear Sam,\n\nStarting on 'Fix alignment issue in settings page' today. Any preliminary thoughts or resources you recommend before I dive in?\n\nBest,\nAmir"
00000280,inbox,carlos.rodriguez@atlas.com,Task Update on Develop prototype for report generation,2023-10-04 10:27:01,"Sam,\n\nI've been assigned 'Develop prototype for report generation'. Excited to work on this and confident it will greatly improve our backend efficiency.\n\nCheers,\nCarlos"
00000021,inbox,santiago.martinez@atlas.com,Task Update on Improve UX of feedback submission,2023-10-04 13:16:55,"Sam,\n\nCompleted task 'Improve UX of feedback submission' ahead of schedule. Please review and let me know if any tweaks are needed.\n\nIv been meaning to discuss the recent changes in our project timelines. We've had to make some adjustments to accommodate new client requirements and to ensure that we're delivering the best possible results. I'll be reaching out to you soon to discuss this in more detail, so please keep an eye out for my next email.\n\nRegards,\nSantiago"
00000145,inbox,santiago.martinez@atlas.com,Task Update on Fix bug in content delivery module,2023-10-04 13:23:34,"Dear Sam,\n\nRegarding task 'Fix bug in content delivery module', I've made significant progress but have hit a snag with database integration. Could use a brainstorm session.\n\nThanks,\nSantiago"
00000067,inbox,amir.ali@atlas.com,Update on Leadership Training Workshop,2023-10-04 13:56:31,"Hi Sam,\n\nEncountered a few challenges while working on the Leadership Training Workshop. Could use your advice.\n\nRegards,\nAmir"
00000124,inbox,chenwei.zhang@atlas.com,Update on Quarterly Sales Review,2023-10-04 14:09:59,"Hey Sam,\n\nEncountered a few challenges while working on the Quarterly Sales Review. Could use your advice.\n\nThanks,\nChenwei"
00000041,inbox,chenwei.zhang@atlas.com,Update on Quarterly Sales Review,2023-10-05 09:25:18,"Sam,\n\nReminder about the Quarterly Sales Review next week. Let's make sure we're all prepared.\n\nRegards,\nChenwei"
00000484,inbox,aisha.chen@atlas.com,Task Update on Fix bug in user management module,2023-10-05 09:45:08,"Hi Sam,\n\nI've been assigned 'Fix bug in user management module'. Excited to work on this and confident it will greatly improve our backend efficiency.\n\nThanks,\nAisha"
00000424,inbox,fatima.khan@atlas.com,Task Update on Add authentication for email notification,2023-10-05 11:09:52,"Sam,\n\nRegarding task 'Add authentication for email notification', I've made significant progress but have hit a snag with UI responsiveness. Could use a brainstorm session.\n\nAdditionally, I wanted to touch base on some other areas we've been focusing on lately. Our team has been working tirelessly on improving our project management workflows and enhancing collaboration across departments. This effort includes adopting new tools, refining our communication strategies, and ensuring that all team members are fully aligned with our objectifs.\n\nRegards,\nFatima"
00000336,inbox,fatima.khan@atlas.com,Task Update on Update Django to latest version,2023-10-05 12:27:35,"Hey Sam,\n\nCompleted task 'Update Django to latest version' ahead of schedule. Please review and let me know if any tweaks are needed.\n\nCheers,\nFatima"
00000133,inbox,nadia.moreau@atlas.com,Task Update on Create wireframe for homepage,2023-10-05 15:54:38,"Hi Sam,\n\nStarting on 'Create wireframe for homepage' today. Any preliminary thoughts or resources you recommend before I dive in?\n\nBest,\nNadia"
00000351,inbox,nadia.moreau@atlas.com,Task Update on Improve UX of feedback submission,2023-10-06 10:24:49,"Sam,\n\nI've been assigned 'Improve UX of feedback submission'. Excited to work on this and confident it will greatly improve our security protocols.\n\nRegards,\nNadia"
00000294,inbox,santiago.martinez@atlas.com,Update on Digital Transformation Conference,2023-10-06 11:04:11,"Hey Sam,\n\nReminder about the Digital Transformation Conference next week. Let's make sure we're all prepared.\n\nRegards,\nSantiago"
00000457,inbox,nia.johnson@atlas.com,Update on Year-End Performance Assessment,2023-10-06 11:21:44,"Dear Sam,\n\nEncountered a few challenges while working on the Year-End Performance Assessment. Could use your advice.\n\nI also wanted to share some exciting news about our upcoming team-building event. We've been planning a fun and engaging day for everyone, and I'm confident it will be a great oppurtunity for everyone to unwind and bond with their colleagues. I'll be sending out more details soon, so keep an eye out for that!\n\nBest,\nNia"
00000007,inbox,akira.sato@atlas.com,Update on Supply Chain Enhancement Workshop,2023-10-06 14:21:17,"Hey Sam,\n\nI'm reaching out to discuss our upcoming Supply Chain Enhancement Workshop. Can we schedule a meeting to go over the details?\n\nBest,\nAkira"
00000162,inbox,yuki.tanaka@atlas.com,Task Update on Update brand colors in website,2023-10-06 14:24:40,"Hey Sam,\n\nStarting on 'Update brand colors in website' today. Any preliminary thoughts or resources you recommend before I dive in?\n\nCheers,\nYuki"
00000272,inbox,nia.johnson@atlas.com,Update on Project Initiation Meeting,2023-10-06 14:29:07,"Sam,\n\nI'm reaching out to discuss our upcoming Project Initiation Meeting. Can we schedule a meeting to go over the details?\n\nThanks,\nNia"
00000161,inbox,chenwei.zhang@atlas.com,Update on sync up,2023-10-07 09:29:36,"Hi Sam,\n\nI have some ideas for the sync up that I'd like to run by you. When are you free?\n\nBest,\nChenwei"
00000142,inbox,santiago.martinez@atlas.com,Update on process review,2023-10-07 09:35:09,"Hey Sam,\n\nI have some ideas for the process review that I'd like to run by you. When are you free?\n\nThanks,\nSantiago"
00000186,inbox,nia.johnson@atlas.com,Update on Machine Learning Chat,2023-10-07 09:53:21,"Hi Sam,\n\nI have some ideas for the Machine Learning Chat that I'd like to run by you. When are you free?\n\nBest,\nNia"
00000024,inbox,luis.ortiz@atlas.com,Update on Corporate Social Responsibility Initiative,2023-10-07 10:32:43,"Hey Sam,\n\nReminder about the Corporate Social Responsibility Initiative next week. Let's make sure we're all prepared.\n\nCheers,\nLuis"
00000388,inbox,leila.azizi@atlas.com,Update on status briefing,2023-10-07 11:09:14,"Hey Sam,\n\nI wanted to let you know that I've completed the tasks for the status briefing. Looking forward to your feedback.\n\nCheers,\nLeila"
00000111,inbox,luis.ortiz@atlas.com,Task Update on Optimize database query for report generation,2023-10-07 11:32:46,"Hi Sam,\n\nStarting on 'Optimize database query for report generation' today. Any preliminary thoughts or resources you recommend before I dive in?\n\nBest,\nLuis"
00000268,inbox,aisha.chen@atlas.com,Update on Leadership Training Workshop,2023-10-07 12:30:49,"Sam,\n\nCould you provide your input on the Leadership Training Workshop planning? Your insights would be really valuable.\n\nI've been meaning to discuss the recent changes in our project timelines. We've had to make some adjustments to acommodate new client requirements and to ensure that we're delivering the best possible results. I'll be reaching out to you soon to discuss this in more detail, so please keep an eye out for my next email.\n\nCheers,\nAisha"
00000335,inbox,raj.patel@atlas.com,Update on Client Appreciation Gala,2023-10-07 13:12:28,"Hey Sam,\n\nEncountered a few challenges while working on the Client Appreciation Gala. Could use your advice.\n\nCheers,\nRaj"
00000189,inbox,leila.azizi@atlas.com,Task Update on Integrate Google Maps API with frontend,2023-10-07 13:42:24,"Dear Sam,\n\nCompleted task 'Integrate Google Maps API with frontend' ahead of schedule. Please review and let me know if any tweaks are needed.\n\nRegards,\nLeila"
00000074,inbox,santiago.martinez@atlas.com,Task Update on Design logo for website,2023-10-07 14:46:22,"Hi Sam,\n\nRegarding task 'Design logo for website', I've made significant progress but have hit a snag with third-party API compatibility. Could use a brainstorm session.\n\nI also wanted to share some exciting news about our upcoming team-building event. We've been planing a fun and engaging day for everyone, and I'm confident it will be a great opportunity for everyone to unwind and bond with their colleagues. I'll be sending out more details soon, so keep an eye out for that!\n\nThanks,\nSantiago"
00000299,inbox,akira.sato@atlas.com,Update on feedback discussion,2023-10-07 15:58:39,"Hi Sam,\n\nReminder about the feedback discussion next week. Let's make sure we're all prepared.\n\nCheers,\nAkira"
00000018,inbox,carlos.rodriguez@atlas.com,Task Update on Update brand colors in website,2023-10-08 09:20:56,"Hey Sam,\n\nCompleted task 'Update brand colors in website' ahead of schedule. Please review and let me know if any tweaks are needed.\n\nCheers,\nCarlos"
00000410,inbox,lena.schmidt@atlas.com,Task Update on Fix alignment issue in settings page,2023-10-08 10:18:30,"Hi Sam,\n\nCompleted task 'Fix alignment issue in settings page' ahead of schedule. Please review and let me know if any tweaks are needed.\n\nBest,\nLena"
00000448,inbox,raj.patel@atlas.com,Update on process review,2023-10-08 10:21:43,"Sam,\n\nEncountered a few challenges while working on the process review. Could use your advice.\n\nThanks,\nRaj"
00000168,inbox,luis.ortiz@atlas.com,Update on Marketing Strategy Session,2023-10-08 10:52:29,"Dear Sam,\n\nI have some ideas for the Marketing Strategy Session that I'd like to run by you. When are you free?\n\nThanks,\nLuis"
00000141,inbox,lena.schmidt@atlas.com,Task Update on Update brand colors in e-commerce platform,2023-10-08 11:21:05,"Sam,\n\nRegarding task 'Update brand colors in e-commerce platform', I've made significant progress but have hit a snag with UI responsiveness. Could use a brainstorm session.\n\nThanks,\nLena"
00000454,inbox,santiago.martinez@atlas.com,Update on Project Initiation Meeting,2023-10-08 11:48:38,"Dear Sam,\n\nCould you provide your input on the Project Initiation Meeting planning? Your insights would be really valuable.\n\nBest,\nSantiago"
00000022,inbox,aisha.chen@atlas.com,Update on team coordination meeting,2023-10-08 12:09:12,"Hey Sam,\n\nI wanted to let you know that I've completed the tasks for the team coordination meeting. Looking forward to your feedback.\n\nThanks,\nAisha"
00000325,inbox,chenwei.zhang@atlas.com,Update on sync up,2023-10-08 12:21:08,"Hey Sam,\n\nI'm reaching out to discuss our upcoming sync up. Can we schedule a meeting to go over the details?\n\nCheers,\nChenwei"
00000408,inbox,yuki.tanaka@atlas.com,Task Update on Integrate Google Maps API with frontend,2023-10-08 12:25:31,"Hi Sam,\n\nRegarding task 'Integrate Google Maps API with frontend', I've made significant progress but have hit a snag with UI responsiveness. Could use a brainstorm session.\n\nI also wanted to share some exciting news about our upcoming team-building event. We've been planing a fun and engaging day for everyone, and I'm confident it will be a great opportunity for everyone to unwind and bond with their colleagues. I'll be sending out more details soon, so keep an eye out for that!\n\nBest,\nYuki"
00000113,inbox,kofi.mensah@atlas.com,Update on project runway briefing,2023-10-08 13:50:10,"Hey Sam,\n\nReminder about the project runway briefing next week. Let's make sure we're all prepared.\n\nBest,\nKofi"
00000089,inbox,lena.schmidt@atlas.com,Update on New Employee Onboarding,2023-10-08 14:06:36,"Hey Sam,\n\nI have some ideas for the New Employee Onboarding that I'd like to run by you. When are you free?\n\nThanks,\nLena"
00000252,inbox,leila.azizi@atlas.com,Task Update on Update brand colors in e-commerce platform,2023-10-09 10:00:52,"Hi Sam,\n\nStarting on 'Update brand colors in e-commerce platform' today. Any preliminary thoughts or resources you recommend before I dive in?\n\nAdditionally, I wanted to touch base on some other areas we've been focusing on lately. Our team has been working tirelessly on improving our project management workflows and enhancing collaboration across departments. This effort includes adopting new tools, refining our communication strategies, and ensuring that all team members are fully aligned with our objectifs.\n\nThanks,\nLeila"
00000005,inbox,lena.schmidt@atlas.com,Task Update on Fix alignment issue in homepage,2023-10-09 10:27:25,"Dear Sam,\n\nI've been assigned 'Fix alignment issue in homepage'. Excited to work on this and confident it will greatly improve our security protocols.\n\nAdditionnally, I wanted to touch base on some other areas we've been focusing on lately. Our team has been working tirelessly on improving our project management workflows and enhancing collaboration across departments. This effort includes adopting new tools, refining our communication strategies, and ensuring that all team members are fully aligned with our objectives.\n\nRegards,\nLena"
00000151,inbox,leila.azizi@atlas.com,Update on Machine Learning Chat,2023-10-09 10:53:58,"Hi Sam,\n\nI'm reaching out to discuss our upcoming Machine Learning Chat. Can we schedule a meeting to go over the details?\n\nBest,\nLeila"
00000242,inbox,nadia.moreau@atlas.com,Task Update on Improve UX of feedback submission,2023-10-09 11:22:24,"Sam,\n\nI've been assigned 'Improve UX of feedback submission'. Excited to work on this and confident it will greatly improve our security protocols.\n\nRegards,\nNadia"
00000369,inbox,raj.patel@atlas.com,Task Update on Add authentication for email notification,2023-10-09 11:40:11,"Dear Sam,\n\nCompleted task 'Add authentication for email notification' ahead of schedule. Please review and let me know if any tweaks are needed.\n\nBest,\nRaj"
00000365,inbox,sofia.santos@atlas.com,Task Update on Add animation to carousel,2023-10-09 12:20:27,"Hey Sam,\n\nRegarding task 'Add animation to carousel', I've made significant progress but have hit a snag with UI responsiveness. Could use a brainstorm session.\n\nAdditionally, I wanted to touch base on some other areas we've been focusing on lately. Our team has been working tirelessly on improving our project management workflows and enhancing collaboration across departments. This effort includes adopting new tools, refining our communication strategies, and ensuring that all team members are fully aligned with our objectifs.\n\nBest,\nSofia"
00000458,inbox,jinsoo.kim@atlas.com,Update on brainstorming session,2023-10-09 14:25:31,"Sam,\n\nReminder about the brainstorming session next week. Let's make sure we're all prepared.\n\nRegards,\nJinsoo"
00000095,inbox,nia.johnson@atlas.com,Update on Product Launch Analysis,2023-10-09 15:46:51,"Hey Sam,\n\nEncountered a few challenges while working on the Product Launch Analysis. Could use your advise.\n\nAdditionally, I wanted to touch base on some other areas we've been focusing on lately. Our team has been working tirelessly on improving our project management workflows and enhancing collaboration across departments. This effort includes adopting new tools, refining our communication strategies, and ensuring that all team members are fully aligned with our objectives.\n\nThanks,\nNia"
00000097,inbox,anaya.patel@atlas.com,Update on Innovation and Creativity Hackathon,2023-10-10 10:30:06,"Hey Sam,\n\nEncountered a few challenges while working on the Innovation and Creativity Hackathon. Could use your advice.\n\nThanks,\nAnaya"
00000020,inbox,luis.ortiz@atlas.com,Task Update on Implement user profile management API,2023-10-10 10:49:16,"Hey Sam,\n\nRegarding task 'Implement user profile management API', I've made significant progress but have hit a snag with UI responsiveness. Could use a brainstorm session.\n\nI've been meaning to discuss the recent changes in our project timelines. We've had to make some adjusments to accommodate new client requirements and to ensure that we're delivering the best possible results. I'll be reaching out to you soon to discuss this in more detail, so please keep an eye out for my next email.\n\nRegards,\nLuis"
00000465,inbox,leila.azizi@atlas.com,Task Update on Implement payment gateway API,2023-10-10 12:07:46,"Hi Sam,\n\nCompleted task 'Implement payment gateway API' ahead of schedule. Please review and let me know if any tweaks are needed.\n\nCheers,\nLeila"
00000175,inbox,luis.ortiz@atlas.com,Update on quarterly tech roundup,2023-10-10 13:38:26,"Sam,\n\nReminder about the quarterly tech roundup next week. Let's make sure we're all prepared.\n\nCheers,\nLuis"
00000034,inbox,yuki.tanaka@atlas.com,Update on Team Building Retreat,2023-10-10 13:45:44,"Sam,\n\nI wanted to let you know that I've completed the tasks for the Team Building Retreat. Looking forward to your feedback.\n\nBest,\nYuki"
00000406,inbox,carlos.rodriguez@atlas.com,Update on Quarterly Sales Review,2023-10-10 14:02:18,"Hey Sam,\n\nI have some ideas for the Quarterly Sales Review that I'd like to run by you. When are you free?\n\nCheers,\nCarlos"
