"query","answer","template","domains"
"Delete my last email from chenwei","['email.delete_email.func(email_id=""00000393"")']","{'query': 'Delete my last email from {name}', 'domains': ['email']}","['email']"
"Delete my last email from dmitri","['email.delete_email.func(email_id=""00000110"")']","{'query': 'Delete my last email from {name}', 'domains': ['email']}","['email']"
"Delete my last email from aisha","['email.delete_email.func(email_id=""00000000"")']","{'query': 'Delete my last email from {name}', 'domains': ['email']}","['email']"
"Delete all my emails from luis from the last 3 days","['email.delete_email.func(email_id=""00000367"")']","{'query': 'Delete all my emails from {name} from the last {days} days', 'domains': ['email']}","['email']"
"Delete all my emails from raj from the last 7 days","['email.delete_email.func(email_id=""00000432"")', 'email.delete_email.func(email_id=""00000409"")', 'email.delete_email.func(email_id=""00000353"")']","{'query': 'Delete all my emails from {name} from the last {days} days', 'domains': ['email']}","['email']"
"Delete all my emails from chenwei from the last 7 days","['email.delete_email.func(email_id=""00000117"")', 'email.delete_email.func(email_id=""00000293"")', 'email.delete_email.func(email_id=""00000393"")']","{'query': 'Delete all my emails from {name} from the last {days} days', 'domains': ['email']}","['email']"
"Send an email to kofi saying 'Hi Sam,

I've been assigned 'Add authentication for third-party login'. Excited to work on this and confident it will greatly improve our user experience.

Cheers,
Raj' and title it 'Task Update on Add authentication for third-party login'","['email.send_email.func(recipient=""kofi.mensah@atlas.com"", subject=""Task Update on Add authentication for third-party login"", body=""Hi Sam,\n\nI\'ve been assigned \'Add authentication for third-party login\'. Excited to work on this and confident it will greatly improve our user experience.\n\nCheers,\nRaj"")']","{'query': ""Send an email to {name} saying '{body}' and title it '{subject}'"", 'domains': ['email']}","['email']"
"Send an email to yuki saying 'Hi Sam,

Encountered a few challenges while working on the Innovation Hackathon. Could use your advice.

I also wanted to share some exciting news about our upcomming team-building event. We've been planning a fun and engaging day for everyone, and I'm confident it will be a great opportunity for everyone to unwind and bond with their colleagues. I'll be sending out more details soon, so keep an eye out for that!

Cheers,
Yuki' and title it 'Update on Innovation Hackathon'","['email.send_email.func(recipient=""yuki.tanaka@atlas.com"", subject=""Update on Innovation Hackathon"", body=""Hi Sam,\n\nEncountered a few challenges while working on the Innovation Hackathon. Could use your advice.\n\nI also wanted to share some exciting news about our upcomming team-building event. We\'ve been planning a fun and engaging day for everyone, and I\'m confident it will be a great opportunity for everyone to unwind and bond with their colleagues. I\'ll be sending out more details soon, so keep an eye out for that!\n\nCheers,\nYuki"")']","{'query': ""Send an email to {name} saying '{body}' and title it '{subject}'"", 'domains': ['email']}","['email']"
"Send an email to dmitri saying 'Hi Sam,

I have some ideas for the debrief that I'd like to run by you. When are you free?

Cheers,
Dmitri' and title it 'Update on debrief'","['email.send_email.func(recipient=""dmitri.ivanov@atlas.com"", subject=""Update on debrief"", body=""Hi Sam,\n\nI have some ideas for the debrief that I\'d like to run by you. When are you free?\n\nCheers,\nDmitri"")']","{'query': ""Send an email to {name} saying '{body}' and title it '{subject}'"", 'domains': ['email']}","['email']"
"Reply to lena's last email about 'Update on Creative Ideation Session' with 'Thanks for the update - I will get back to you tomorrow.'","['email.reply_email.func(email_id=""00000317"", body=""Thanks for the update - I will get back to you tomorrow."")']","{'query': ""Reply to {name}'s last email about '{subject}' with 'Thanks for the update - I will get back to you tomorrow.'"", 'domains': ['email']}","['email']"
"Reply to luis's last email about 'Update on Supply Chain Optimization Workshop' with 'Thanks for the update - I will get back to you tomorrow.'","['email.reply_email.func(email_id=""00000379"", body=""Thanks for the update - I will get back to you tomorrow."")']","{'query': ""Reply to {name}'s last email about '{subject}' with 'Thanks for the update - I will get back to you tomorrow.'"", 'domains': ['email']}","['email']"
"Reply to carlos's last email about 'Update on Health and Wellness Fair' with 'Thanks for the update - I will get back to you tomorrow.'","['email.reply_email.func(email_id=""00000140"", body=""Thanks for the update - I will get back to you tomorrow."")']","{'query': ""Reply to {name}'s last email about '{subject}' with 'Thanks for the update - I will get back to you tomorrow.'"", 'domains': ['email']}","['email']"
"Forward all the emails from aisha last week about 'Task Update on Update Flask to latest version' to leila","['email.forward_email.func(email_id=""00000086"", recipient=""leila.azizi@atlas.com"")']","{'query': ""Forward all the emails from {name} last week about '{subject}' to {recipient_name}"", 'domains': ['email']}","['email']"
"Forward all the emails from dmitri last week about 'Task Update on Fix alignment issue in settings page' to aisha","['email.forward_email.func(email_id=""00000414"", recipient=""aisha.chen@atlas.com"")']","{'query': ""Forward all the emails from {name} last week about '{subject}' to {recipient_name}"", 'domains': ['email']}","['email']"
"Forward all the emails from raj last week about 'Update on brainstorm' to santiago","['email.forward_email.func(email_id=""00000431"", recipient=""santiago.martinez@atlas.com"")']","{'query': ""Forward all the emails from {name} last week about '{subject}' to {recipient_name}"", 'domains': ['email']}","['email']"
"Forward the latest email about 'Update on Employee Recognition Ceremony' to kofi","['email.forward_email.func(email_id=""00000072"", recipient=""kofi.mensah@atlas.com"")']","{'query': ""Forward the latest email about '{subject}' to {recipient_name}"", 'domains': ['email']}","['email']"
"Forward the latest email about 'Task Update on Integrate Google Maps API with frontend' to chenwei","['email.forward_email.func(email_id=""00000408"", recipient=""chenwei.zhang@atlas.com"")']","{'query': ""Forward the latest email about '{subject}' to {recipient_name}"", 'domains': ['email']}","['email']"
"Forward the latest email about 'Update on Global Market Expansion Discussion' to sofia","['email.forward_email.func(email_id=""00000239"", recipient=""sofia.santos@atlas.com"")']","{'query': ""Forward the latest email about '{subject}' to {recipient_name}"", 'domains': ['email']}","['email']"
"Forward my most recent email from jinsoo to aisha","['email.forward_email.func(email_id=""00000041"", recipient=""aisha.chen@atlas.com"")']","{'query': 'Forward my most recent email from {sender_name} to {recipient_name}', 'domains': ['email']}","['email']"
"Forward my most recent email from nadia to fatima","['email.forward_email.func(email_id=""00000280"", recipient=""fatima.khan@atlas.com"")']","{'query': 'Forward my most recent email from {sender_name} to {recipient_name}', 'domains': ['email']}","['email']"
"Forward my most recent email from amir to chenwei","['email.forward_email.func(email_id=""00000254"", recipient=""chenwei.zhang@atlas.com"")']","{'query': 'Forward my most recent email from {sender_name} to {recipient_name}', 'domains': ['email']}","['email']"
"Forward the last email about 'Task Update on Integrate Google Maps API with frontend' to chenwei and carlos","['email.forward_email.func(email_id=""00000408"", recipient=""chenwei.zhang@atlas.com"")', 'email.forward_email.func(email_id=""00000408"", recipient=""carlos.rodriguez@atlas.com"")']","{'query': ""Forward the last email about '{subject}' to {recipient_name1} and {recipient_name2}"", 'domains': ['email']}","['email']"
"Forward the last email about 'Update on Marketing Strategy Brainstorm' to olga and luis","['email.forward_email.func(email_id=""00000279"", recipient=""olga.petrova@atlas.com"")', 'email.forward_email.func(email_id=""00000279"", recipient=""luis.ortiz@atlas.com"")']","{'query': ""Forward the last email about '{subject}' to {recipient_name1} and {recipient_name2}"", 'domains': ['email']}","['email']"
"Forward the last email about 'Task Update on Optimize database query for report generation' to nadia and luis","['email.forward_email.func(email_id=""00000483"", recipient=""nadia.moreau@atlas.com"")', 'email.forward_email.func(email_id=""00000483"", recipient=""luis.ortiz@atlas.com"")']","{'query': ""Forward the last email about '{subject}' to {recipient_name1} and {recipient_name2}"", 'domains': ['email']}","['email']"
"Reply to the latest email from nia with 'Got it, thank you!'","['email.reply_email.func(email_id=""00000173"", body=""Got it, thank you!"")']","{'query': ""Reply to the latest email from {sender_name} with 'Got it, thank you!'"", 'domains': ['email']}","['email']"
"Reply to the latest email from kofi with 'Got it, thank you!'","['email.reply_email.func(email_id=""00000318"", body=""Got it, thank you!"")']","{'query': ""Reply to the latest email from {sender_name} with 'Got it, thank you!'"", 'domains': ['email']}","['email']"
"Reply to the latest email from luis with 'Got it, thank you!'","['email.reply_email.func(email_id=""00000367"", body=""Got it, thank you!"")']","{'query': ""Reply to the latest email from {sender_name} with 'Got it, thank you!'"", 'domains': ['email']}","['email']"
