"query","answer","template"
"Delete my last email from Chenwei","[""email.delete_email.func(email_id='00000246')""]","{'query': 'Delete my last email from {name}', 'answer': [""email.delete_email.func(email_id='{last_email_id}')""]}"
"Delete my last email from Sofia","[""email.delete_email.func(email_id='00000399')""]","{'query': 'Delete my last email from {name}', 'answer': [""email.delete_email.func(email_id='{last_email_id}')""]}"
"Delete my last email from Leila","[""email.delete_email.func(email_id='00000168')""]","{'query': 'Delete my last email from {name}', 'answer': [""email.delete_email.func(email_id='{last_email_id}')""]}"
"Forward my most recent email from Kofi to Luis","[""email.forward_email.func(email_id='00000274', recipient='Luis.Ortiz@company.com')""]","{'query': 'Forward my most recent email from {sender_name} to {recipient_name}', 'answer': [""email.forward_email.func(email_id='{last_email_id}', recipient='{recipient_email}')""]}"
"Forward my most recent email from Chenwei to Fatima","[""email.forward_email.func(email_id='00000246', recipient='Fatima.Khan@company.com')""]","{'query': 'Forward my most recent email from {sender_name} to {recipient_name}', 'answer': [""email.forward_email.func(email_id='{last_email_id}', recipient='{recipient_email}')""]}"
"Forward my most recent email from Anaya to Amir","[""email.forward_email.func(email_id='00000409', recipient='Amir.Ali@company.com')""]","{'query': 'Forward my most recent email from {sender_name} to {recipient_name}', 'answer': [""email.forward_email.func(email_id='{last_email_id}', recipient='{recipient_email}')""]}"
"Send an email to Dmitri saying 'Attached is the weekly report for your review.' and title it 'Weekly Report'","[""email.send_email.func(recipient='Dmitri.Ivanov@company.com', subject='Weekly Report', body='Attached is the weekly report for your review.')""]","{'query': ""Send an email to {name} saying '{body}' and title it '{subject}'"", 'answer': [""email.send_email.func(recipient='{recipient_email}', subject='{subject}', body='{body}')""]}"
"Send an email to Anaya saying 'Please review and approve the attached budget proposal.' and title it 'Budget Approval Request'","[""email.send_email.func(recipient='Anaya.Patel@company.com', subject='Budget Approval Request', body='Please review and approve the attached budget proposal.')""]","{'query': ""Send an email to {name} saying '{body}' and title it '{subject}'"", 'answer': [""email.send_email.func(recipient='{recipient_email}', subject='{subject}', body='{body}')""]}"
"Send an email to Kofi saying 'Please find the monthly sales figures in the attached document.' and title it 'Monthly Sales Figures'","[""email.send_email.func(recipient='Kofi.Mensah@company.com', subject='Monthly Sales Figures', body='Please find the monthly sales figures in the attached document.')""]","{'query': ""Send an email to {name} saying '{body}' and title it '{subject}'"", 'answer': [""email.send_email.func(recipient='{recipient_email}', subject='{subject}', body='{body}')""]}"
