"query","answer","template","domains"
"Find the email from November 9 about 'Task Update on Add authentication for cloud storage' and schedule a 1.5 hour meeting called 'Task Update on Add authentication for cloud storage' at 12 with the sender for December 13.","['calendar.create_event.func(event_name=""Task Update on Add authentication for cloud storage"", participant_email=""luis.ortiz@atlas.com"", event_start=""2023-12-13 12:00:00"", duration=""90"")']","{'query': ""Find the email from {natural_language_email_date} about '{subject}' and schedule a {natural_language_duration} meeting called '{subject}' at {natural_language_time} with the sender for {natural_language_meeting_date}."", 'domains': ['email', 'calendar']}","['email', 'calendar']"
"Find the email from October 18 about 'Task Update on Optimize database query for search functionality' and schedule a 1.5 hour meeting called 'Task Update on Optimize database query for search functionality' at 11:30 with the sender for December 13.","['calendar.create_event.func(event_name=""Task Update on Optimize database query for search functionality"", participant_email=""akira.sato@atlas.com"", event_start=""2023-12-13 11:30:00"", duration=""90"")']","{'query': ""Find the email from {natural_language_email_date} about '{subject}' and schedule a {natural_language_duration} meeting called '{subject}' at {natural_language_time} with the sender for {natural_language_meeting_date}."", 'domains': ['email', 'calendar']}","['email', 'calendar']"
"Find the email from October 7 about 'Task Update on Design UI for settings page' and schedule a 30 minute meeting called 'Task Update on Design UI for settings page' at 1 with the sender for December 1.","['calendar.create_event.func(event_name=""Task Update on Design UI for settings page"", participant_email=""santiago.martinez@atlas.com"", event_start=""2023-12-01 13:00:00"", duration=""30"")']","{'query': ""Find the email from {natural_language_email_date} about '{subject}' and schedule a {natural_language_duration} meeting called '{subject}' at {natural_language_time} with the sender for {natural_language_meeting_date}."", 'domains': ['email', 'calendar']}","['email', 'calendar']"
"Send an email to attendees of the first event on December 13. Title it with the event name and tell them 'Remember to attend this event.'","['email.send_email.func(recipient=""kofi.mensah@atlas.com"", subject=""Financial Forecasting Meeting"", body=""Remember to attend this event."")']","{'query': ""Send an email to attendees of the first event on {natural_language_event_date}. Title it with the event name and tell them 'Remember to attend this event.'"", 'domains': ['email', 'calendar']}","['email', 'calendar']"
"Send an email to attendees of the first event on December 8. Title it with the event name and tell them 'Remember to attend this event.'","['email.send_email.func(recipient=""aisha.chen@atlas.com"", subject=""Strategic Planning Retreat"", body=""Remember to attend this event."")']","{'query': ""Send an email to attendees of the first event on {natural_language_event_date}. Title it with the event name and tell them 'Remember to attend this event.'"", 'domains': ['email', 'calendar']}","['email', 'calendar']"
"Send an email to attendees of the first event on December 6. Title it with the event name and tell them 'Remember to attend this event.'","['email.send_email.func(recipient=""lena.schmidt@atlas.com"", subject=""Marketing Strategy Brainstorm"", body=""Remember to attend this event."")']","{'query': ""Send an email to attendees of the first event on {natural_language_event_date}. Title it with the event name and tell them 'Remember to attend this event.'"", 'domains': ['email', 'calendar']}","['email', 'calendar']"
"If leila hasn't sent me any emails in the past 3 days, schedule a 30 minute meeting with them for Monday at 10 called 'Catch up with leila'","['calendar.create_event.func(event_name=""Catch up with leila"", participant_email=""leila.azizi@atlas.com"", event_start=""2023-12-04 10:00:00"", duration=""30"")']","{'query': ""If {name} hasn't sent me any emails in the past {days} days, schedule a 30 minute meeting with them for {day_of_week} at {natural_language_time} called 'Catch up with {name}'"", 'domains': ['email', 'calendar']}","['email', 'calendar']"
"If lena hasn't sent me any emails in the past 2 days, schedule a 30 minute meeting with them for Wednesday at 3 called 'Catch up with lena'","[]","{'query': ""If {name} hasn't sent me any emails in the past {days} days, schedule a 30 minute meeting with them for {day_of_week} at {natural_language_time} called 'Catch up with {name}'"", 'domains': ['email', 'calendar']}","['email', 'calendar']"
"If aisha hasn't sent me any emails in the past 3 days, schedule a 30 minute meeting with them for Friday at 12:30 called 'Catch up with aisha'","[]","{'query': ""If {name} hasn't sent me any emails in the past {days} days, schedule a 30 minute meeting with them for {day_of_week} at {natural_language_time} called 'Catch up with {name}'"", 'domains': ['email', 'calendar']}","['email', 'calendar']"
"If I haven't met with jinsoo in the past 2 days, send them an email titled 'Catch up soon?' saying 'We have not caught up in over 2 days - can you send some availability over next week?'","['email.send_email.func(recipient=""jinsoo.kim@atlas.com"", subject=""Catch up soon?"", body=""We have not caught up in over 2 days - can you send some availability over next week?"")']","{'query': ""If I haven't met with {name} in the past {days} days, send them an email titled 'Catch up soon?' saying 'We have not caught up in over {days} days - can you send some availability over next week?'"", 'domains': ['email', 'calendar']}","['email', 'calendar']"
"If I haven't met with luis in the past 3 days, send them an email titled 'Catch up soon?' saying 'We have not caught up in over 3 days - can you send some availability over next week?'","[]","{'query': ""If I haven't met with {name} in the past {days} days, send them an email titled 'Catch up soon?' saying 'We have not caught up in over {days} days - can you send some availability over next week?'"", 'domains': ['email', 'calendar']}","['email', 'calendar']"
"If I haven't met with anaya in the past 3 days, send them an email titled 'Catch up soon?' saying 'We have not caught up in over 3 days - can you send some availability over next week?'","['email.send_email.func(recipient=""anaya.patel@atlas.com"", subject=""Catch up soon?"", body=""We have not caught up in over 3 days - can you send some availability over next week?"")']","{'query': ""If I haven't met with {name} in the past {days} days, send them an email titled 'Catch up soon?' saying 'We have not caught up in over {days} days - can you send some availability over next week?'"", 'domains': ['email', 'calendar']}","['email', 'calendar']"
"If I don't have any meetings scheduled with dmitri.ivanov@atlas.com in the next 4 days, send them an email titled 'Catch up soon?' saying 'We have not caught up in a while - can you send some availability over next week?'","['email.send_email.func(recipient=""dmitri.ivanov@atlas.com"", subject=""Catch up soon?"", body=""We have not caught up in a while - can you send some availability over next week?"")']","{'query': ""If I don't have any meetings scheduled with {email} in the next {days} days, send them an email titled 'Catch up soon?' saying 'We have not caught up in a while - can you send some availability over next week?'"", 'domains': ['email', 'calendar']}","['email', 'calendar']"
"If I don't have any meetings scheduled with raj.patel@atlas.com in the next 4 days, send them an email titled 'Catch up soon?' saying 'We have not caught up in a while - can you send some availability over next week?'","[]","{'query': ""If I don't have any meetings scheduled with {email} in the next {days} days, send them an email titled 'Catch up soon?' saying 'We have not caught up in a while - can you send some availability over next week?'"", 'domains': ['email', 'calendar']}","['email', 'calendar']"
"If I don't have any meetings scheduled with nadia.moreau@atlas.com in the next 3 days, send them an email titled 'Catch up soon?' saying 'We have not caught up in a while - can you send some availability over next week?'","[]","{'query': ""If I don't have any meetings scheduled with {email} in the next {days} days, send them an email titled 'Catch up soon?' saying 'We have not caught up in a while - can you send some availability over next week?'"", 'domains': ['email', 'calendar']}","['email', 'calendar']"
"If kofi has any overdue tasks, send them an email titled 'Overdue tasks' saying 'You have a few overdue tasks - can you update me on them?'. Otherwise email them with 'Nice work keeping on top of your tasks this sprint!' titled 'Good work this sprint'","['email.send_email.func(recipient=""kofi.mensah@atlas.com"", subject=""Overdue tasks"", body=""You have a few overdue tasks - can you update me on them?"")']","{'query': ""If {name} has any overdue tasks, send them an email titled 'Overdue tasks' saying 'You have a few overdue tasks - can you update me on them?'. Otherwise email them with 'Nice work keeping on top of your tasks this sprint!' titled 'Good work this sprint'"", 'domains': ['email', 'project_management']}","['email', 'project_management']"
"If amir has any overdue tasks, send them an email titled 'Overdue tasks' saying 'You have a few overdue tasks - can you update me on them?'. Otherwise email them with 'Nice work keeping on top of your tasks this sprint!' titled 'Good work this sprint'","['email.send_email.func(recipient=""amir.ali@atlas.com"", subject=""Overdue tasks"", body=""You have a few overdue tasks - can you update me on them?"")']","{'query': ""If {name} has any overdue tasks, send them an email titled 'Overdue tasks' saying 'You have a few overdue tasks - can you update me on them?'. Otherwise email them with 'Nice work keeping on top of your tasks this sprint!' titled 'Good work this sprint'"", 'domains': ['email', 'project_management']}","['email', 'project_management']"
"If nia has any overdue tasks, send them an email titled 'Overdue tasks' saying 'You have a few overdue tasks - can you update me on them?'. Otherwise email them with 'Nice work keeping on top of your tasks this sprint!' titled 'Good work this sprint'","['email.send_email.func(recipient=""nia.johnson@atlas.com"", subject=""Overdue tasks"", body=""You have a few overdue tasks - can you update me on them?"")']","{'query': ""If {name} has any overdue tasks, send them an email titled 'Overdue tasks' saying 'You have a few overdue tasks - can you update me on them?'. Otherwise email them with 'Nice work keeping on top of your tasks this sprint!' titled 'Good work this sprint'"", 'domains': ['email', 'project_management']}","['email', 'project_management']"
"If jinsoo has any overdue tasks, book a half hour meeting with them called 'Catch up on overdue tasks' at the earliest time I'm free tomorrow and send them an email titled 'Discuss overdue tasks' saying 'I noticed you have a few overdue tasks - let's catch up tomorrow.' Otherwise email them with 'Nice work keeping on top of your tasks this sprint!' titled 'Good work this sprint'","['calendar.create_event.func(event_name=""Catch up on overdue tasks"", participant_email=""jinsoo.kim@atlas.com"", event_start=""2023-12-01 09:00:00"", duration=""30"")', 'email.send_email.func(recipient=""jinsoo.kim@atlas.com"", subject=""Discuss overdue tasks"", body=""I noticed you have a few overdue tasks - let\'s catch up tomorrow."")']","{'query': ""If {name} has any overdue tasks, book a half hour meeting with them called 'Catch up on overdue tasks' at the earliest time I'm free tomorrow and send them an email titled 'Discuss overdue tasks' saying 'I noticed you have a few overdue tasks - let's catch up tomorrow.' Otherwise email them with 'Nice work keeping on top of your tasks this sprint!' titled 'Good work this sprint'"", 'domains': ['email', 'calendar', 'project_management']}","['email', 'calendar', 'project_management']"
"If sofia has any overdue tasks, book a half hour meeting with them called 'Catch up on overdue tasks' at the earliest time I'm free tomorrow and send them an email titled 'Discuss overdue tasks' saying 'I noticed you have a few overdue tasks - let's catch up tomorrow.' Otherwise email them with 'Nice work keeping on top of your tasks this sprint!' titled 'Good work this sprint'","['email.send_email.func(recipient=""sofia.santos@atlas.com"", subject=""Good work this sprint"", body=""Nice work keeping on top of your tasks this sprint!"")']","{'query': ""If {name} has any overdue tasks, book a half hour meeting with them called 'Catch up on overdue tasks' at the earliest time I'm free tomorrow and send them an email titled 'Discuss overdue tasks' saying 'I noticed you have a few overdue tasks - let's catch up tomorrow.' Otherwise email them with 'Nice work keeping on top of your tasks this sprint!' titled 'Good work this sprint'"", 'domains': ['email', 'calendar', 'project_management']}","['email', 'calendar', 'project_management']"
"If carlos has any overdue tasks, book a half hour meeting with them called 'Catch up on overdue tasks' at the earliest time I'm free tomorrow and send them an email titled 'Discuss overdue tasks' saying 'I noticed you have a few overdue tasks - let's catch up tomorrow.' Otherwise email them with 'Nice work keeping on top of your tasks this sprint!' titled 'Good work this sprint'","['calendar.create_event.func(event_name=""Catch up on overdue tasks"", participant_email=""carlos.rodriguez@atlas.com"", event_start=""2023-12-01 09:00:00"", duration=""30"")', 'email.send_email.func(recipient=""carlos.rodriguez@atlas.com"", subject=""Discuss overdue tasks"", body=""I noticed you have a few overdue tasks - let\'s catch up tomorrow."")']","{'query': ""If {name} has any overdue tasks, book a half hour meeting with them called 'Catch up on overdue tasks' at the earliest time I'm free tomorrow and send them an email titled 'Discuss overdue tasks' saying 'I noticed you have a few overdue tasks - let's catch up tomorrow.' Otherwise email them with 'Nice work keeping on top of your tasks this sprint!' titled 'Good work this sprint'"", 'domains': ['email', 'calendar', 'project_management']}","['email', 'calendar', 'project_management']"
